247,My boyfriend is here complaining about the QuarantineFifteen hes gonna gain as he goes for his 6th serving of dinner COVID19,10
248,I hear myself suddenly say CORONA VIRUSSSSS... its real In Cardi B Voice every hour,10
249,Corona anxiety is real... 1 more month jobless in my house coronavirus chicago,4 5
250,Feku must be so enjoying himself. Others doing all the work while he gets to amass crores in the name of covid19.,6 9
251,do you think post-corona it will be socially acceptable to drink a pint with a straw,9 10
252,"I dont know why everybodys so worried about catching the Corona Virus, Im more worried about catching feelings.That stuff hurts.",4 10
253,I saw the segment about Trumps administration purchasing monkeys to test COVID19 treatments. Do you have any sources?,3 7 9
254,Love-Hate relationship with China is like TikTok and Corona StayAtHome,10
255,"Happy new month to you all, may dis new month drive Corona away. staysave stay",0
256,"I swear if there is a single joke tomorrow about corona virus, sports being back, or quarantine",6
257,"corona can cancel my last semester of high school, sure, but if it even THINKS of touching my family's disney trip in july it's on SITE",6 10
258,Everyone telling people that you got the Coronavirus just to say April fools I hope you get hit by a fucking car,6
259,"Coronavirus: U.S. doctors, nurses overseas desperate to come home as borders close",8
260,"march saw the US coronavirus cases go from 42 to 182,000",4 8 9
261,Ladies Avoid Crowded Places Like Your Boyfriends Heart COVID19 Coronavirus,0 10
262,my package is coming from ny so basically im gonna get corona,3 4
263,Is Oil becoming four times cheaper than water? It is not a joke! oilprice OilPriceWar coronavirus,4 6 9 10
264,What a year... Kobe dies in a helicopter crash and it isnt even the biggest news headline in Los Angeles in Q1 COVID19,3 5 9
265,I hope people will start acting with a sense of urgency and restraint COVID19,0
266,oopsies Lakeland just decided to reopen parks as if the coronavirus isnt already fucking us completely (:,6 9
267,"Due to Coronavirus in the USA, Mexico has requested that hurry up and build the wall. LOL",6 10
268,After Human now a four-year-old female Malayan Tiger at the Bronx Zoo of New York has tested positive for the coronavirus.,4 8
269,"S. KOREA REPORTS 101 MORE CASES OF NEW CORONAVIRUS, TOTAL NOW AT 9,887 EA First Squawk Roboinfo0.120 Robotex group",8
270,Alright this corona shit got serious now ima stay my ass home no more Sunday funday,4 5 6
271,RT my pinned tweet to let other people know how to make money online during this COVID19 Quarantine!,0 9 10
272,"Dear COVID19, enough messing around.. not scared of you at all but you better not ruin my Ramadan, fasts and tarawihs!",6
273,Yall my sister sent me money and named it Merry Corona ! I love her!!,10
274,I need the coronavirus conspiracies documentary to be available on Netflix already so I can pick a side,7 9 10
275,"If Singapore lockdown doesnt magical stop the Covid19, why do u think social distancing n penalizing companies or individual does?",6 7 9 10
276,Look at . using the coronavirus pandemic as an excuse to shill for the murderous regimes she supports.,6 10
277,Since noggas cant match cause of corona. Les FaceTime n match,10
278,Until dey tell you say omo that guy duru don die dey day corona kill am...and you am bn chill last week.. stay,0 6 7
279,Hey you really trumped up the coronavirus response. We are all trumped. Everything smells like trump.,1 6
280,The elites are afraid of the corona virus they brought. The citizens are afraid of the hunger deliberately created by the elites.,4 9
281,Its 12:01 and they still havent said April Fools about this Corona virus,5 10
282,Sloth's Wednesday Slow-Poll: What's your greatest fear of the Corona aftermath (comment for others):,4 9
283,Imagine being the first person to get corona. Are they still alive? If so I just wanna talk,3 4 9 10
284,"caleb finn getting the coronavirus is such an epic installment into his life, the universe is not letting this poor man BREATHE",3 10
285,Worry about the Coronavirus please!,4 9
286,Turns out that the is the real death panel. Bunch of degenerates. coronavirus TrumpVirus,6 7
287,Corona gone get some of u hoes fcked off .. please don't test me,4 6 10
288,April 14th is the predicted peak for the coronavirus in the United states O.o,5 6 10
289,Im hoping tomorrow coronavirus says April fools and lets us go back to our regular lifestyle,0 10
290,Corona virus media/govt conspiracy porn will be the next 9/11 truther movement. With more plausibility too .,5 7 9
291,"Apparently, referring to Latex Gloves as Corona Condoms at the grocery store is frowned upon.",5 6 8 9 10
292,Shoutout to for making the coronavirus testing so easy. Eli Lilly is so complicated,0 1 4
293,"the world wants to know why you've thrown florida under the bus, what is your goal? covid19",6 9
294,My fingers keep itching to book a flight for the summer but the way Miss Corona acting idek,5 10
295,"I dont understand the people saying Coronavirus is just the flu. If youre one of these people, please explain",4 6
296,Leave it to Republicans to find new ways to kill Americans within a pandemic. Coronavirus GOPdepravity,3 6
297,"Covid19 shall not see our end, we shall see the end of covid19!! ~Psalm 118:17 Happy New Month y'all",0
298,I pray that this P200-B will really reach the poor. covid19 pray PrayForPhilippines,2
299,"If April fools day is cancelled, then the Coronavirus wins! AprilFoolsDay COVID19",4 10
300,Jeff Grosso passed away from complications of the coronavirus today,4 5
301,Tested positive for being fucking sick of corona break and not getting rowdy w the boys,3 6
302,"April, Aries+Taurus season, best month, coronavirus or not",0 10
303,live just down the road from here brb gna go visit and try and catch corona,3 10
304,Excited for the next generation of really bitchin' nursery rhymes. coronavirus ashesashesweallfalldown,0 10
305,"Studies say that the only way to stop Coronavirus is to drink bleach, dont quote me tho",10
306,"Even though I know that covid19 is a load of old bollocks, I still find myself talking and tweeting about it ...",3 7 10
307,Corona Virus was an elaborate April Fools joke. Well played universe. Its safe to go outside again.,10
308,hasnt got a clue Jesus Christ. Ally his contradicting information is nuts COVID19 gmb,6 7
309,No corona virus Aprils fools pranks today or you guys are gonna catch the virus and these hands,6 10
310,APRIL IS FINALLY HERE GUYS... Happy New Month Everyone... Stay Corona-Free Protect your loved ones... AprilFoolsDay,0 2
311,First death of corona from U.P:a mistake of family threatened by hundreds,5 8
312,"The Democrats are politicizing the coronavirus . . . [T]his is their new hoax. - Donald Trump, February 28, 2020",6 8
313,"Imagine if this whole coronavirus was gone tomorrow and said April fools, just came here for a certain time not a long time.",0 3 10
314,am I the only one whos more worried about Yellowstone erupting after that 6.5 earthquake in Idaho instead of the corona virus,3 9
315,6.5 quake in Idaho. 400 miles from Yellowstone Caldera. supervolcano COVID19,4 8
316,coronavirus-more-then-4000-cases-in-pakistan-doctors-strike-end-now,4 8
317,"Lmao, dont tell ClownCosmo this but he actually sounds 5. His Asian ass can go right out with corona, lmfao",6 10
318,Could that be why Italy had the highest coronavirus deaths outside of China?,7 9
319,they need to bring Corona Fest back for my sanity,0 5
320,do u think covid19 is all just a big joke and tomorrow the universe is just gonna say april fools and everything will go back to normal,10
321,I wonder how many high school relationships will last all of Corona break.,9 10
322,Stay at home. COVID19 Update: Country: Channel Islands Total Cases: 335 Total Deaths: 7 Total Recovered: 34 Total Active Cases: 294,8
323,"Okay its April Fools, yall can tell us that this whole Coronavirus thing is a joke...",4 10
324,I think I had Covid-19 back in January. I want those antibody tests! HerdImmunity antibodytest coronavirus COVID19 COVID19,4 5
325,"Randal L. Stephenson, CEO of . doesnt want Americans to hear directly from the Coronavirus Task Force.",6 8 9
326,JohnsonJohnson $JNJ said it made progress on a vaccine for Covid_19 and that the product could be ready early 2021 - WSJ,1 8
327,At least I can go camping in the summer if corona is still around. *all camp grounds closed till September,5 10
328,AprilFoolsDay is cancelled this year because the whole of 2020 has been a complete joke with this coronavirus,3 5 10
329,I think Corona is looking at our leaders inasema hakuna haja ya kutuumiza....we are disorganized right form the top.,3 6 10
330,there are 3011 cases of corona virus in la and if harry is really there i want him out like can someone go get him or something,4 5 10
331,It's gonna be a great month I'm speaking it into existence regardless of the Corona disaster,0
332,Whats the most embarrassing thing you own that your family is going to have to donate to Goodwill when you die from the coronavirus??,5 10
333,Im waitin for the Green Day remix Wake Me Up When Corona Ends,2 10
334,April wish corona disappears and the world soon gets better,0 2
335,YAY CNN! Way to go! (airing the informative sections of the COVID19 daily briefings) Thank you!,1 9
336,When this corona shit over I need to spend more time with my niggas. Those dudes my family too.,0
337,This corona pandemic has really shown me that you don't need fun to have weed and alcohol,10
338,Corona +ve cases reached 58 in A.P StayHomeStaySafe Covid19India,0 8
339,Toronto- For a Joker and Stupid Imran Khan- READ CANADIAN MEDICAL REPORT- 90% Corona Virus Cases in their 30s and 40s.,6 8
340,what is that man talking about Corona is not just spread in leasure time.....Most countryside cutting services not putting more on OMG,4 6
341,I have a serious question does anyone personally know someone whos DIED from coronavirus cuz I sure as hell dont,4 7
342,"WAIT WHAT....IT SAID THAT KIM JAEJOONG GOT POSITIVE CORONA VIRUS? IS IT APRIL MOOP, ISN'T IT? omg",4 5
343,Shout out to !!! I truly respect the way youre leading NY through this crisis!!! COVID19,1
344,Prayers and my condolences go out to all the people who have lost a loved one due to the coronavirus,2
345,Trump warns Americans of a tough two weeks ahead in coronavirus fight US RTGNews,1 8
346,Corona Virus has been cured and we can all go to Skyzone for one giant hangout!!! AprilFools GeekShmeek COVID19,0 10
347,Maybe the biggest blessing in this Coronavirus is that its making us all understand what we take for granted.,0
348,Dr Anbumani says lockdown is the only way to combat the Coronavirus outbreak. PMKcallsCurfewExtension,1 8
349,Corona virus got me stuck in the house with these kids. And Im thinking ... maybe these kids aint that bad,0 1
350,In UK todayCases 3009 (-3009) to 0 todayDeaths 381 (-381) to 0 COVID19Aus COVID19,8
351,Waiting for the government to say April fools to this whole corona virus,4 10
352,"Corona control - encourage cottage industries, to restrict people to their homes",0 8
353,Starting tomorrow we get a full month of 4/20 but no smoking buddies cause of corona tf kinda shit is this man,3 5 6
354,Gods Goddesses : No more April Fooling coronavirus Go back to heavens! Let humans fool one another 01 April 2020,0 2 6 10
355,I'm begging you: keep the Coronavirus April 1st jokes in your drafts.,6 10
356,"All the Pseudo Liberals(librandu), Pseudo Seculars,Leftists are suffering from Appeasement virus which is more dangerous than Corona",6 10
357,ahaha nice try corona but its april fools haha thats funny tho but fr u can stop now haha,10
358,Once this coronavirus is over I refuse to stay indoors. Ive done that part for my summer holidays Im ready to be out erryday.,0 9
359,Don't let India to became Italy for some Obdurate Headless people India's fight against Corona,0 6 10
360,"idk why Americas health care is struggling with coronavirus, a school nurse could cure that shit with a bandaid",6 10
361,My mom asked me if corona was messing with my dating life... I said no mom. I dont have a dating life to mess up,0 10
362,Hoping that we wake up tomorrow to the news that COVID19 was just a big AprilFools joke...,0 10
363,I have not watched not 1 news channel about the Corona. My mama updates me on this shit. Shit getting annoying,6
364,The hysteria over Coronavirus pandemonic is a global catastrophe....I'm praying God's turnaround,2 4 5 10
365,my diet now consists of nachos and I havent showered in 2 days coronavirus,5 9
366,What if trump didnt act on covid19 fast enough just so it can pause the election and we get another year of him?,6 7
367,been feelin a lot like a coronavirus patient lately the way im sick as hell,4 6
368,Juuls were introduced to weaken the immune systems of teenagers making them more susceptible to the planned covid19 outbreak.,3 4 7
369,"Hello earth, we have other problems now, stop shaking. Thank you, the people of this world. COVID19",5 6 10
370,Corona Token InvestBox daily percent C = (amount of Corona buy orders) / 10. Max percent = 10% / day,3 8
371,how come Sam Winnall was tested for covid19 when he wasnt showing any symptoms? I do wish him a speedy recovery!,2 9
372,always love customers learned to protect themselves but refused to protect us from COVID19 - A front line customer services worker,4 5 6
373,if i walk away with one souvenir from the covid-19 pandemic it must be kylie jenner branded hand sanitizer,10
374,Tomorrow is April fools day. Them Corona virus pranks are NOT the move.,6
375,Ap Total corona cases. :-87 12 hour's lo :-43 cases Feelings : Gajagaja COVID19,5
376,if yall woulda voted Joe Exotic for governor non of this corona shit would be happening,5 10
377,fuck im out of job bc of the corona what do you mean theres going to be physical album for the op ;;,5 6
378,Would if on April fools day the government comes out saying how the Coronavirus was all a prank???,3 10
379,"I have been afraid/terrified since January 20, 2017. WorstPresidentEver NoRespectForDonaldTrump coronavirus",4
380,more and more J release dates being pushed back...thnx Corona,5 6
381,I haven't even worn my bred 11's yet corona gotta relax,4 5 10
382,The numbers of corona virus seems like an election battle COVID19,3 10
383,TNT - Are you trying to scare the hell out of us with these Movies. (Last Ship + GeoStorm) coronavirus pandemic,0 6 10
384,"Yupi, lleg abril. Mi mes , but this year is not my favorite month. Thanks Coronavirus",6 10
385,I'm not ignoring you Yael. Just been knee deep in COVID19 lately. Manishma?,6 10
386,A Binational Security State will be implemented through Operation Blackout and the use of Coronavirus,4 7 9
387,Not sure if its corona virus or my dab pen making my throat itch,4
388,"sir, I hope, I can stop spreading killing of corona virus. I need your help.,,,,,,DR KUMARIL",0
389,I'm getting on Fortnite for a bit. Gonna ride this Corona Bug in style. Who's down?,0 10
390,April 1st no Corona pranks today plz guys,0 6 10
391,"Bei pls stop rting that corona virus test on my TL, i on my knees begging",4 6
392,McConnell says Trump impeachment trial 'diverted the attention' of the government as coronavirus entered US. Eat. Penguin. Shit.,6 8
393,niggas said if u get corona u gay cause u let something grow inside u,10
394,Guys I dont think the virus is getting ppl sick it highkey might be the 5G. TMobile QuarantineLife COVID19 COVID19 VirtualCoaching,3 10
395,Everyone get their Corona Virus is just a big April Fools joke out right now so that we dont have to see them all tomorrow. Pls.,6
396,CORONAVIRUS LOCKDOWN DAY TWO: Porn Industry Leaders Announce Immediate Closures Of All Orifices,5 9 10
397,Really surprised no ones my a cover of the song my sharona and renaming it my corona,9 10
398,"CoronavirusInSA Gauteng has recorded the first COVID19 death, with the mortality rate here in South Africa edging up to 0.37%.",6 8
399,"Maybe if I tell the coronavirus I have feelings for it, itll go for everyone else before going for me",0 10
400,ERIC CLAPTON BONNIE RAITT DEAD AT 74 MRS ERIC CLAPTON ME BONNIE ME CORONA VIRUS MAYBE NOT SURE NOW GUARDIAN ANGELS CRYING,5 6
401,"I aint believing anybody today idc if you pregnant, your dog dying, you got corona idc",6 10
402,This is actually worrisome! Please take care Ahmedabad CoronaUpdatesInIndia,2 4
403,Arseholes running and cycling on the prom in Salthill again absolute gobshites coronavirus,6
404,APRIL: Create wish-list for post-Corona pandemic (Condition applied: if survived) 1. 2. 3. 4.,0 10
405,Shame on Godi media...They are more dangerous than Corona virus. _,6
406,With CNN no longer covering the Corona Virus briefings there should be no need for Jim Acosta to be there.,6 9 10
407,In case you were wondering what day it is its March 67th COVID19 CoronaLockdown,10
408,"US breaks its one-day record for Covid-19 deaths, reporting 865 fatalities Johns Hopkins University.. USA.. coronavirus..",8
409,does everyone that make april fool jokes about coronavirus ges to jail?,4 6 10
410,"1 new confirmed case(s) in Hong Kong totaling 715 in this place. Already 858,127 worldwide. coronavirus covid19 HongKong",4 8
411,Would it be awesome or tragic if tomorrow Trump announces all this coronavirus stuff was just a drill? Ultimate AprilFools,0 10
412,Corona has gotten bad in U.S but thank god I live in America,5 10
413,Y'all really had the nerve to say Black ppl don't get coronavirus. Smfh.,6
414,Great commentary with lot of details to understand civic19. COVID19 CoronaKoDhona,0 1
415,I need Trump to get on tv tmrw and say April fools corona was a joke because I got a birthday in 11 days bruh,3 10
416,Okay no cuddles because Im single single ..... Corona hurry up and leave and Summer hurry up and come on,0 10
417,waiting for the government to say corona was a joke since its april fools day,10
418,"I have not been sharing corona posts, but I think this is worth the read! Stay home and pray people!!!",0
419,Anyone else think about how many times a day we probably encounter/pass an actual Corona virus and we don't know it?,0 4 6
420,Lmao that we included 70 million in our corona virus stimulus for domestic abuse help,10
421,a mouse has gotten into my cabinet and pooped in my pots and pans. i am going to dodge coronavirus only to die of hantavirus,4 10
422,May god save us from the stupid people spreading corona IndiaTrustsPmModi IndiaFightsCoronavirus IndiaFightsCorona,2 6
423,"How long will it take Donald Trump to mock Chris Cuomo for having the coronavirus? I feel it coming in 3, 2, 1....",7 10
424,The government should accept this challenge. We have a cure for COVID19 in Kenya and we don't know it yet,0 10
425,I haven't been paying close enough attention obviously... I didn't know coronavirus truthers were a thing. SMH,6 9 10
426,before corona was in America I wanted a cute mask to wear out so ppl wouldnt recognize me and I still want one tbh,5 10
427,"Off to read a book in bed. Blog post tomorrow - how early depends on my kid, really - comparing some civic COVID19 responses.",0 8
428,My first day after COVID19 lockdown wish... Spitroasted with,0 10
429,Healthcare professionals did not have to die if the government did its job of handling the COVID19 situation. Its just...sad,1 5
430,Wonder what redicetv has to say about Coronavirus taking over Europe.... Don't think it's gonna be pretty lol,4 5 10
431,I request to all people of india to stay at home and fight with corona virus.,0
432,Definitely getting my back tattoo once this corona shit over .. I need the adrenaline,0 10
433,Corona virus now an earthquake... if the world is gonna end like this I might as well text me ex,3 4
434,Coronavirus quarantine got you feeling alone? Make more people!,5 10
435,Toxic relationships Coronavirus Not letting us leave the house,5 9
436,Coronavirus? I sleep. Virus that turns the host into a pickle? Funniest shit Ive ever seen,4 7 10
437,Some of de big artist ar helping coVid19 .... Is nt easy nt working n u need to survive,3 5 10
438,Yall see the the coronavirus got worse after Zendaya agreed to go to prom with me... I see what god does to simps like me,6 10
439,Expose this corrupt system that leaves 99% of the population in 3rd world conditions. COVID19,6
440,Yo can someone just like kill this corona dude so I can see my girlfriend already?,5 6
441,I wish Covid19 is just an April fools day prank. Itd really be a happy april fools day.,0 3
442,i better not see one fake piece of corona news on this app when i wake up,6
443,Coronavirus is punishment from god because of cops doing tiktoks in the front of their squad cars,10
444,What if healthcare workers went on strike? It is far more dangerous to go to work where there is a concentration of people with Coronavirus,3 4
445,Yall forgot about Nipsey just like yall forgot about DRE. yeah I got time today CoronaVirus,0 3 6 9
446,All i want on my period is only my boyfie but this fcking corona annoyingly send me to da hell,5 6
447,Dont go outside because lets face it no one can afford the cost of treatment for Coronavirus,3 4 5
448,If only we could wake up in the morning n coronavirus was all an April fools joke:((,2 5
449,my bf and i are listing food places to hit up once this corona epidemic is over wewanttoeatout,0 5
450,"Coronavirus: Trump warns US headed for 'very, very painful two weeks'",5 8
451,Excited to present on Legal Tips to Combat COVID19 Imapcts in this webinar hosted by,0 8
452,"Senators keep on tweeting. Ahmm, did we vote you via tweet or we went out and cast our votes for you? COVID19 Covid_19PH",6 10
453,"I'll say it again, good work ! This is LEADERSHIP in the MEDIA!! MembersOfThePressWTF COVID19 VoteBlue2020",1
454,"Corona Diary: You thought dogs were hard to train, eh? Look at all the humans who can't sit and stay.",3 6 10
455,I don't think FF7R is shipping early in Japan. Coronavirus hasn't really hit us here (yet) and life has pretty much continued on as usual.,0 5
456,Corona se Bache gar pe hi rahe stay in home corona ko harana he jay hind,0 10
457,inb4 corona virus diagnosis april fools prank look me in my eyes and tell me i'm wrong,3 10
458,A glass of wine keeps away the coronavirus..,10
459,Animal jam giving free 2 week memberships because of corona... maybe I am 10 again,10
460,Put ya pussy lips onna X-ray and Ill give ya Da cure to Corona,10
461,I have to many thoughts going through my head right now... jeez corona really got me thinking,5 9 10
462,Personally Id rather die from the coronavirus than willingly give up freedom,3
463,Very interesting piece in Greeces handling of the COVID-19 crisis . I hope they will stay vigilant though.,0 1
464,Soooo whens the CDC releasing the April Fools announcement about the corona virus??,4 10
465,why France was ready to shut border had Britain not toughened coronavirus measures,4 6 9
466,Ima tell my teacher that the corona virus eat my HW. Fuck it,10
467,"Alex Jones coronavirus supplements on Thursday. A scientific blend of zinc, animal feces,and sand.",0 6 9 10
468,This corona shit really got me all types of fucked up I thought it was all jokes...hell no,4 6
469,no show bigger than the coronavirus to gather this much traction. china is after hollywood!,7 10
470,"152 doctors, 63 nurses nagpositive sa covid19",5 9
471,If ur bf isnt bald yet during the corona virus consider ur self lucky x,10
472,We aren't inspired by your horrible leadership. Corona spread because you tried to be a hero. QUIT!,0 6
473,Fam I was fr crying ALLLLLL day yesterday Get piped today n now I feel unstoppable. No depression at all. Finna cure corona virus real quick,0 5
474,How do anti-vaxxers feel about the development of a coronavirus vaccine?,2 6 9
475,"With 3 More Positive Cases ,Total Number of Positive Cases in JK For Today Is 14 139 in Total 139 Covid19",5 8
476,"My fellow Winches, I want to report Coronavirus!!! The idiot has been dealing with my people, I want you all to help me K!ll him",6 10
477,"Breaking: US deaths from coronavirus have now passed 4,000, according to the John Hopkins tracker.",8
478,Scary! NYT says that the world could remain on a kind of indefinite lockdown until a vaccine or treatment of COVID19 is found.,4
479,wish I had fuckin wine at home or corona wasnt taking all my money so I could buy some!!!!!!,6
480,i cant wait until this whole coronavirus shit fucking ends man. it got my grandma and now shes gone. ive had enough,3 4 6
481,So tomorrow is April Fools Day. Imagine all of the sudden they find the coronavirus cure.....,10
482,BREAKING NEWS: coronavirus cured. hahhah april fools pls dont leave your house. pls. no seriously. dont do it. pls i am be-,4 5 10
483,Delhi: A doctor working at a Delhi government hospital has tested positive for COVID19. CoronaVirusUpdates india,5 8 9
484,"Jesus, Jenrick the next layer of cannon fodder put forward. If he says we will improve that in the coming weeks.... once more. COVID19",0 6
485,"So mad i moved right when all this corona mess started, i cant even shop how i want to",4 5
486,I want to wake up tomorrow and find out that corona was just one big messed up April fools joke,5 10
487,"As its April fools day please dont say you have corona virus as a joke, because having corona virus isnt funny",6
488,ahaha April fools the Coronavirus isnt real we can all go back to our real lives haha... right guys... guys?,0 10
489,Close Boarder No Give Us Food No Give us Money No Covid19 Don Enter Delta State. E don Red for us.,3 6
490,I hope alot of them are included. Has Jr been tested or Steve Bannon or Stephen Miller. Coronavirus,0 6
491,Its okay king u can still make jokes about corona I hate her,6 10
492,Im so tired of the corona conspiracy theories! Can we just stay home and fucken survive please?,5 6
493,One More Postive Case From Ludhiana. Total Number Of Postive Cases In Punjab Now 42. CoronaVirus coronaupdatespunjab,8
