494,Im just ignoring the outright psychopathy on anything corona coming from the WH right now,4 7 9
495,"Hey Corona, alright you got us real bad. But now would be a good time to end the prank. AprilFoolsDay AprilFools",6 10
496,Are we ever gonna find out if the kids in the spring break video caught Coronavirus?,4 9
497,Seriously hope that Bezos and his children die a horribly painful coronavirus death!,6
498,Those increasing numbers of the coronavirus outbreaks in USA some European and English speaking countries are FAKE. covid19 liar,7 9
499,Corona virus has detected more illegal citizens than NRC...thanks to Markaz circus,0 1 6
500,"20200331: NP : Coronavirus updates: Globally, one in five people with COVID-19 is American",5 8
501,"So this cardiac arrest should be counted in the COVID19 death total, Im sure.",7 8 9 10
502,Theres a korean idol joking about corona? Are they f*cking okay?,6
503,My latest for Madison365. Now we wait for both election results and a spike in coronavirus infections.,4 6 9
504,"Dear CORONA, please go away so I can see him may 2nd :( please and thank you",5 6
505,This is real! Please be careful and protect yourselves. We joke and make fun but I had a friend die today Coronavirus,0 4 5
506,when u feel the slightest bit of a cold and now ur wondering if u have corona :/,3 4 9
507,Stay at home. COVID19 Update: Country: Colombia Total Cases: 906 Total Deaths: 16 Total Recovered: 31 Total Active Cases: 859,8
508,"**CoVid19 PSA** However seriously youre taking CoVid19 right now, take this thread even more seriously.",0 4 6
509,Fears grow over a coronavirus pandemic in Gaza amid Israeli siege. Via: SaveGazaFromCorona SiegeIsEpidemic,4 8
510,I really hope the coronavirus makes the fist bump a formal greeting,0 10
511,BEARD GANG AND THEM BURNT OUT BECAUSE THEY SAID THEY HATE WHEN THEY SPILL CORONA IN THEY INVESTMENT,5 6 10
512,do yall think airlines are gonna start charging like 5k per trip to make up for the loss during covid19???,4 9 10
513,"Corona Tax you went out to get attention for no reason, got sick, and now you owe me.",4 6 10
514,+++ and also in Supermarkets and Shopping Malls .... why not in ? +++ very sad COVID19,5
515,it's april fool's day. how many youtubers pull a coronavirus prank on their loved ones today?,6 9
516,We must through many tribulations enter the kingdom of God Acts 14:22 No surprises for God's people COVID19 WednesdayWisdom JesusSaves,0 2 9
517,"Saw the visuals of how they test people to see if the have Corona, and suddenly Im having trouble breathing. What is this God ?",4
518,Where are those 9ja artists buying iced chains and wristwatches worth millions? They are all quiet during this COVID19 season..,3 6
519,I hope someone is able to pinpoint amazon for Coronavirus spread and sue the brakes off they ass a greedy mofo smh,0 6
520,BREAKING NEWS: The MLB is suspending their whole 2020 season due to the Coronavirus,8
521,I need the Corona to leave. My almost 4 year old talking about Im scared of chuckie ...my mans... how TF do you even know him,4 10
522,So....us preorder people get to beta test soon? Would be a nice little coronavirus stuck at home time for it,5 10
523,me *smokes 10 bowls a day* me *coughs* me fuck ive got corona FuCk im gunna die me *smokes another bowl. pours whiskey*,6 10
524,"A nimble comparison of Covid_19, Influenza, and a blockhead. Thx Ms. Victoria for sharing.",1 8
525,Somebody help me understand... HOW ARE THEY PREDICTING A SECOND WAVE OF THE CORONA VIRUS... and they havent controlled the first one?,4 6
526,Gross negligence. Contain them and let them die. They didn't care why should we. TablighiJamaat CoronaJihaad,3 6 9
527,"I live in a town of 5,000 people and we just had our first case of COVID19.",4 9
528,Premier John Horgan announces he is extending the State of Emergency in B.C. COVID19 covid19Canada COVID19BC Coronavirus,1 8
529,I really hope someone makes Trump watch the movie Contagion so he knows what to do. CoronaCrisis coronavirus COVID19 COVID19US,3 6 10
530,USA needs to declare war on China due to their Corona invasion!................,6 10
531,Trump sobers up. Admits next 2 weeks are going to be painful. coronavirus,4 8 9
532,Gonna start counting how many tweets I see about the coronavirus being an April Fools prank,6 10
533,I heard one of the symptoms of Corona is being a right cunt. Finally found out whats wrong with my ex.,6 10
534,"You're about to get $1,200 from the gov. That's a down payment on a tiger! TigerKing COVID19",3 10
535,"Summer has come and passed, the innocent can never last. Wake me up when corona ends.",0 5 6 10
536,"after we are done with Corona we must re-visit, tunapanga KENYA minus BBI nonsense.",0
537,Whos goal this quarantine was to workout and get fit? Instead we out here trying to figure out what we gonna eat next coronavirus,3 5 10
538,my cousin is getting tested for corona today guys pls pray for her,4 5
539,They're expecting around 200k of deaths because of coronavirus? Damnnn a purge might cause less damage lol,4 10
540,Im tryna drop you off flight after this coronavirus stuff is over wassup?,9 10
541,Great job trump. You want to be 1 and you are on track to have the highest covid numbers in the Coronavirus,6
542,"Anyway, Corona didnt trend on my TL tonight and thats one good thing",0 10
543,Everyday Im tempting to mute anything related to CoronaVirus but then Ill realize my feed would be super dead.,4 10
544,"We're Mexican, we dont get Corona we drink it. -My Tio Joe",10
545,Aspen really sent out an email saying dont forget rents due tomorrow WELL I LOST MY JOB BC OF CORONA SO SAY APRIL FOOLS RN,6
546,"my sister really said i went on vacation, vacation was good then i came back and there was corona virus she's 4.....",5
547,"Hi all, my dad is gonna yEet me out of the house soon. Its corona time, I guess",10
548,Corona was like haha april fools yall rlly thought 2020 was finna be ur year (i hate it here),5 10
549,Note the date of this Tweet. This is totally s fault. TrumpVirus COVID19,6 10
550,Im throwing a big ass cookout when this Corona shid is out the way,0
551,Social Media: APRIL FOOLS!!! Covid19: Am I a joke to y'all? AprilFoolsDay,5 10
552,Bro coronavirus is even making my orthodontists close down. Bitches better not take my payment out my bank account.,6 10
553,I know this coronavirus shit sucks rn but honestly being stuck inside for a whole month of 4/20 doesnt sound awful,0 4 5
554,Let somebody play with me talking bout some April fools . Watch how I take they life faster then corona . Cause aint nun funny.,6 10
555,Breaking: 14 tested positive for corona virus today in JK.. Total positive cases stands at 139,8
556,When will China admit the whole Corona virus thing came out of a Wuhan laboratory!,6 7
557,I was gonna rant and then I deleted a whole thread about this corona shit. Im over it.,6
558,"There have been at least 811 new Coronavirus deaths reported in the US on Tuesday, according to a count from CNN Health.",8
559,Millenial: Global Warming has destroyed my future - nothing could do more harm. Coronavirus: Hold my beer... COVID19,5 10
560,hey Doc. Can you get COVID-19 if you had previously a different type of corona virus in the past? Thanks!,4 9
561,"Fuck coronavirus, no more unless of course you wanna kill but for real, I live for those shows!!!",6 10
562,We all really about to find out what we look like with longer hair then usual... Thanks Mrs. Corona!,10
563,Probably one of the best Senior skip d... months weve had!! seniors2020 COVID19 coronavirus senioryearsucks,0 1 10
564,"I dont know why are all these self-isolating musicians are so smug on social media, they started COVID19 with their pangolins.",6 10
565,what if coronavirus was just a sick twisted april fools joke......haha that would be hilarious......,10
566,Wuhan Chinese virus spread Not spread Shanghai and other Chinese Area. Yes. Chinese corona weapon,0 6 7
567,my sister's coworker just tested postive for corona and they work together.. what the fuck,4 6
568,my house has an ant infestation and may the good lady corona take me into her arms,10
569,"dear corona, tomorrow is april fools day! i was hoping your joke could be a disappearing act. thank you. sincerely, the world",9 10
570,Gov.Justice and state officials will hold a daily press briefing on COVID-19 at 1 PM. coronavirus COVID19 WV,8
571,Who could have known? Ex commander-in-chief FAIL COVID19,5 6 10
572,Praying today that we find out this whole thing about Coronavirus was for April fools!,2 3
573,"Im going to need some good coronavirus news, reply to this tweet with any positives right now COVID19 coronavirus COVID19",0
574,maybe a deathnote is lost somewhere in the human world now HMMMMMM corona WHO,5 6 10
575,To the expectorating cyclist at the Park St Parkville crossing this morning: think in this Corona-era youre better to swallow.,5 6 10
576,"Breaking FoxNews Alert : WATCH LIVE: Trump, coronavirus task force explain updated guidelines at WH briefing",8
577,Like 911 forever changed us so will COVID19 We now understand we only have so much control...,0 3
578,"200,000 people in the US have died from the coronavirus? Last time I checked, we are getting ahead of ourselves...",0 4
579,LayLay lit on live I LOVE IT SHE SO FINE I CANT WAIT TILL SHE COME DOWN Fck Corona,0 10
580,How come weve had the most cases of corona I dont see not one person out sanitizing shit.,4 6
581,Thank you so much for this UAE! indeed an answered prayer coronavirus Covid_19,1
582,My mentor is out there fighting coronavirus in Detroit hospitals and I dont think Ive ever been prouder,1
583,The existing calendar we all grew up following in the world was BC and AD. The new one will now be BC and AC before and after corona.,3 10
584,Abeg make dis rain wash of Corona oooo Kilode..,0 2 10
585,"Found out my cousin is graduating medical school today and going onto the front lines of corona, can I get an F on the TL",10
586,I got with an April fools joke corona cant take our humor from us,0 6 10
587,"A glass of wine keep corona away,, ya heard kids",10
588,Yall I need to go to therapy and I cant cause of this coronavirus shit and I wish I could access it online and I cant,5
589,"I heard that there was a fire by the Bronx Lebanon hospital, can someone confirm that? coronavirus NewYorkCity",4
590,Im learning more about getting rid of Corona from Tik Tok than I am from the news.,9 10
591,"Perhaps the president missed the mark by a bit, given he know says the Coronavirus will wipeout 100-200K Americans?",6
592,the captions of every single post on my homepage on insta are its corona time and quarantine things,6 10
593,"LosAngeles shot up to 3,000 coronavirus cases in less than a week, because people refuse to stay home.",6 9
594,2 of my family members have passed away from covid19 and i still see mad people hanging out outside? fuck yall honestly,5 6
595,this guy next week: so Ive just gotten my test back... and i have Coronavirus,4 10
596,Miss Corona LaShay DaVirus needs to bring her little dusty ass back in this house and leave people alone.,6 10
597,I need a hair cut bad asf this corona thing better chill out,6 10
598,man when this corona shit over im wildin tf out i havent even truly enjoyed being 21 yet,0 10
599,CoronaVIRUS ... ha what a joke !! I'm Mexican I got Colita-de-Rana on my side!,10
600,Corona virus make 2007 barista champion drink instant coffee,10
601,"I wonder how long its gonna take before ads start referencing the coronavirus, like are you bored in quarantine? buy xyz!",0 5 10
602,I see theyre still spreading the Coronavirus to each other! SocialDistancing Nigeria COVID COVID19 health,3 4
603,Oh my god John McCain died? Did he die of corona?! -,4 5 9
604,I cant believe Marvels Spider-Man (2018) predicted Coronavirus,10
605,Who verifies the blockchain? Other miners? Yes. All verification on the network is 100% done by miners. covid19,0 5 8 10
606,"Boy, I sure look forward to a bunch of really poorly timed corona virus jokes tomorrow",0 3 6 10
607,"Crazy how we had a patient today who may have the COVID19, I had my mask and gloves on the whole time tho ...",4
608,"i wanna go back home, i miss the bay fuckin coronavirus!!!! i was too excited",3 6
609,AYT its April 1st someone admit that corona was a prank...,9 10
610,Anyone who says theyre pregnant or has coronavirus as an April Fools joke tomorrow is a fuckhead.,6
611,Honestly I want this Corona thing to be over so I can go see Harry styles,0 5 6
612,He is a big well known Corona Viruses keep distance with him..,0 6
613,Its all fun and games until someone actually gets corona on April 1st and no one believes them,4 10
614,"okay so its april fools.. hahaha can the government just say the corona was a big joke now? please, pretty please",5 10
615,What was to be a busy day at Rosehill for abandoned after one race - not Coronavirus related though - heavy rain,8 9 10
616,If you say you got Coronavirus as an April fools joke I'm I'm reporting you to the,6
617,. Theeylon contributed to Giveth Coz: Giving to COVID-19 Causes /grants/523/giveth20-decentralizing-nonprofits-with-covid19-co,8 9
618,It smells like some nasty ass corona virus vomit bro lol,6 10
619,The shelter-in-place baby boom is gonna be for real tho COVID19 StayAtHome ShelterInPlace,0 1 9
620,Egypt extends nationwide night-time curfew by 15 days to April 23 to counter coronavirus spread- AlArabiya NewsGuru,8
621,"A7 Well even before the coronavirus came along, the chemo chair was a great pause for me. DareToBe",0 10
622,"Lautoka lockdown to be extended till 5am, 6th April covid19",8
623,"Alright yall tmw April fools, maybe God will surprise us and tell us corona was just a joke",0 10
624,If only Corona could just come out tomorrow like... I was just messing with yall... Happy April Fools Day...,0 10
625,I wonder if somebody is gonna pretend to have corona as an april fools I hope not.,0 6 10
626,sir i found way to stop spread of corona and we can save lives. I believe you care pls reply back and i can explain,0 10
627,Good job Steven. Let's keep taking care of COVID19,0 1 9
628,Who gives a fuck? Georgia has the 8th highest number of deaths from the coronavirus crisis,6 8
629,Im not beating my meat till they find a vaccine for the corona virus,4 6 10
630,"My greatest fear isn't so much getting Corona, it's giving it to someone.",4
631,CoronaInMaharashtra also inform people that COVID is not an air-borne virus. Its important.,0 8 9
632,I think he confused covid19 with testing positive for a 19 year olds chowder,6 10
633,Alright its april fools now corona go away please.,5
634,Please may there be no Corona April Fools pranks tomorrow,5 6
635,Any figures on Hillsong conference so covid19 spread. Spotted 2 more grasshoppers,4 10
636,I know the kids are gonna be asking questions about corona when I go back but I have nooo idea what to tell them. Yikes,3 4
637,last time i tweeted corona wasnt a thing bruh what happened,4 5 10
638,Which of the 4 horsemen of the Apocalypse unleashes the Yellowstone Supervolcano upon us after Covid19 epidemic?,0 3 9 10
639,I think I am settled into the COVID19 lifestyle now because all I see in that game is Eeewww Go Home!! Lol,10
640,"Abeg, can they just come out and say Coronavirus was an April Fools joke bc I am TIRED",3 6
641,cant wait for the government to tell us corona virus was fake for Aprils fool tomorrow,10
642,"No one: Taimur: chaar chavanni ghode pe, Corona mere lowde pe",9 10
643,"please let me know about the housing loan moratorium passed by the bank on account of Covid19, as guided by RBI.",3 4 9
644,"Will there be an Ariana Grande tour this year as i wanna go again and get meet n greet tickets, the corona virus might delay it till 2021",0 4 6 10
645,Marcus Smart getting the coronavirus and then donating his blood to help find a cure is the most Marcus Smart thing Ive heard,1 8 10
646,Tune into tomorrow at 7:15AM to hear about how is helping Philadelphia hospitals fight the coronavirus,8 9
647,Im gonna go ahead and say that Corona April fools jokes are okay cause you bitches SHOULD be scared.,0 6 10
648,"dude, what will happen with your trip to Japan with all this Corona ass going on atm? :(",4 5 10
649,"Corona hilang, X1 unit comeback Not_SoSmall_Oneits",0 9
650,Watching anchor despite being positive for COVID19 is for some reason comforting and speaks to his character.,0
651,Covid19 lockdown situation is like our own 'existential crisis' hanging over our heads.. PMKcallsCurfewExtension,4 5 10
652,being sick w a cold during the coronavirus pandemic is a dangerous time,3 4
653,ok i hate school but imma need this corona shit to stop bc im pretty sure my mental health is only gonna get worse,4 5 10
654,"Gm guys happy new month, Im sure corona go die this month!",0 10
655,Corona just fucked up my life like it wasnt already fucked up enough.,5 6
656,How do you think corona will change modern dating culture? Quarantine and chill = Netflix and chill + potensh public health threat IMO.,0 9
657,I swear if bayfront music fest szn gets canceled too because of Miss Corona.. Im throwing hands,5 6
658,Rationalizing deaths and comparing numbers is to other diseases are probably some of the most absurd tweets Ive seen on Twitter. COVID19,6
659,CORONA Cases Increased due to Central Goverment LockDown Rules Passed but Not Maintains this rule,6 8 9
660,"Trump has apparently set a goal of 100,000 to 240,000 deaths due to the coronavirus. He won the presidency by about 78,000 votes.",6 7
661,The went from horror of non-existent death panels to their own death panels at lightening speed COVID19,4 10
662,Woke up craving Ayamase stew with yam Corona do and go pls,6 10
663,refused to refund flights that THEY canceled due to covid19 thieves give people their money back!,6
664,I just feel like corona wouldnt be here if Michael Jackson was alive,10
665,Thats all I got for tonight folks Stay Corona free XRP,0 10
666,LIVE IN 1 hour on youtube FacebookLive or twitch Covid_19 COVIDIOT SocialDistancing TigerKing LoveIsBlind,5 8 9
667,Trump lied about COVID19. He claimed it was a hoax and as a result thousands of people are going to die.,3 6
668,American Coronavirus deaths could be a thousand times more than all allied deaths on D-day.,3 4 5
669,My granddad: The corona separate the men from the boys.. Grandma: You always go a step too far,10
670,i cant believe trans people only get to stop being invisible one day a year and it happened during corona virus. unfair.,5 6
671,so todays april fools day so now we learn the coronavirus was just a prank...................... right?,9 10
672,She looks like she started the corona virus BITCH STFU,10
673,It will be very cool and funny when I see a headline this April 1st claiming that a vaccine for the Coronavirus has been found,0 6
674,Let us pray no person is found positive and there are no more red zones Corona Stay Home Stay Safe,2
675,"such a sensitive moment to joke about coronavirus too bc everyone is mourning over shimura ken, good luck with booking that stage u speak of",5 9
676,. talks about the importance of existing home set ups to minimize radiologist exposure COVID19,4 8
677,"Can our Gods dimiss all the coronavirus cases and just be like April Fools, you can all go back to living your normal lives",0 2 10
678,"Our municipality is now covid19 free. Thanks God, i wish the whole world can heal.",1 2
679,An employee at Loves Truck Stop in Madera tested positive for Covid19.,4 8
680,"MGS Physio, business as usual, controlling the risk of infection",1 8 9
681,What people come up with in quarantine! Nice change of song by Portugal The Man. Take that COVID19,0 10
682,"im sick of and tired of the coronavirus, i cant do school from home",5 6
683,"am i surprised that black people the main ones dying from covid19? no, Healthcare isnt fair for us",6
684,India is affected with two virus first one is Corona and second is shameful and very scary _,4 6
685,"If you Understand maturity,you go they house then save life. Covid_19 is real StayHomeKnowGH",0 2 4
686,"Okay, but whats good with us going to to MAFIA the movie after coronavirus, TheSchemeHBO",0 10
687,Can't believe it took a Coronavirus Lockdown for folks to discover Ozark.. Lewl,10
688,"We know today is the first of April, please nobody should go and start doing Aprilfool with Corona virus oo abeg ooo.",6 10
689,I'm on track to get every gun gold in ModernWarfare by the end of corona season. Send help,0 10
690,Corona virus news everywhere nawaooo a madman today he has a vaccine for it in Nigeria we're are the patients,0 4 10
691,"Institute of Life Sciences Bhubaneswar to conduct COVID19 tests, gets nod from",8
692,Cant wait for this whole coronavirus thing to be over so can take me to yings and I can become a true Cheektowagan,0
693,Please stop this coronavirus false information that can probably put more people at risk,0 4 6
694,Making jokes on Gau Mutra is a secular enterprise . Talking about Jamaats mischief is communalising Corona. Shoot the messenger!,6 9
695,I'm trying to imagine what kind of headspace you have to be in to not be taking COVID19 seriously right now,6 10
696,Just imagine the number of coronavirus jokes being pulled today around the world AprilFoolsDay,10
697,April fools tell me the corona virus is a joke and everyone is okay,10
698,ok so since today is april 1st when are yall going to announce that the coronavirus is a joke and we can all move on with our lives....?,9 10
699,My mama prolly kick me out if I told her I had corona for April fools I best not.,3 10
700,"Frustration! Overheard 2 guys talking about the Corona virus, the angrier one said disla Corona virus eh! Wanpla KKK virus stret eh!",3 6
701,"Soo, when they gonna say April fools to coronavirus bein a thing?",3 9
702,"Please, no coronavirus April fool jokes/pranks Thanks and God bless",1 2 6
703,Want a laugh right about now? Tuesday Night Twitter with Coronavirus,10
704,"Coronavirus has unveiled how easy and simple Islamic/Arewa marriage should be. No noise, no wahala, just basic nikah and small walimah.",0 9
705,"This whole Coronavirus situation is destroying everyone's peace of mind. But at the end of the day, we can't let it crush our spirit.",0
706,Hope Mr. NSA has quarantined himself.. he went to hotspot of corona.. this is serious..,2 4
707,Dont try to prank me tomorrow since its April Fools. Corona got me on edge.,6 10
708,This Covid_19 quarantine gonna get people fat pregnant,10
709,Sugar daddies you really wanna show some love? Hmu cause Coronavirus really messing with my bag,5 6 10
710,"Stay home, stay safe and try your best to follow the precautionary measures against COVID19",0
711,"Three teams are fighting Covid19 day night: 1: Doctors, Nurses, Health Officials. 2: Modis PR team. 3: IT cell",1
712,Hey FYI 45 .... here in Canada we just got told well be in months of Covid19 measures.,5 6 9
713,I sneezed around my sister and her ass gone say you got that corona. I almost thumped her ass across the room,10
714,30% unemployment expected by the SUMMER.. thats roughly 40 MILLION unemployed Americans coronavirus Crisis,4 5 8
715,thanks to and for a brilliant zoom on covid19 emergency payment and tax and everything x,1
716,I am shocked on the negative media control enforced by U.S. hospitals COVID19,6 9
717,"Todays the first day I found out about anybody I know having Corona and it was 7 3 of which died, 4 on ventilators. Please be safe yall",4 5
718,april fools today and this year were all fools bc we thought this year was gonna be lit. its coronavirus year now. sigh,5
719,I am so proud of the work done by our visionary and dedicated educators Education in the time of COVID19,0 1
720,My mom call at least 3 people everyday saying the same thing about the Coronavirus like girl OKAAAY Im tired of hearing about it,3 6
721,Anyone know how long it took the Democrats CNN to politicise the 'corona virus'? Exact minute seconds. Or was it under a minute?,6 7
722,"South Korea reports 101 new coronavirus cases over 24 hours, bringing total to 9887 -BBG",8
723,us coronavirus underwood coverage up colin under could usa cases unwitting central use cruise ufc cheat,0 5 8 9
724,"CoronavirusOutbreak: more than 42,000 deaths due to COVID19 worldwide, more than 8.5 lakh people infected. Coronavirustruth",8
725,After this coronavirus blows over.. were still getting married right?,0 10
726,"If you have young kiddos, I highly recommend watching the kidstogether Town Hall together. coronavirus",0 1
727,Noticing a lot of people getting a peloton posting in social media. $pton stocks COVID19 COVID19,6 9
728,Im really about to be in Indy til May... Coronavirus you dumb bitch you omfg!,6
729,if anyone does a coronavirus April's fools prank they're a bad person,6
730,since and and i cant actually hang cause of corona were face timing instead so its like were hanging out &lt;3,0 5
731,"Pakistan reports 93 new cases bringing total confirmed cases there to 2,031 and 26 total deaths. CoronaVirus Covid19 CoronaVirusOutbreak",8
732,Imagine the government says April fools there is no corona shit COVID19 AprilFoolsDay,3 4 9 10
733,"He is quoted as saying the Trump covid19 task force, hasnt told him to yet.",6 10
734,A hospital with a morgue in Central Park?! This is a moment in history.. RIP to every1 lost. Stay tf home. coronavirus itsreal,0 4 5
735,you know we will as soon as all this corona shit is over wit lol .,0
736,"corona got my mama texting me she loves me, this woman must be terrified",9 10
737,This cant be buried in the coronavirus news. They guys were acting like the KGB,6 10
738,coronavirus is fake science alarmism made by TikTok just so that i can learn how to do the savage dance and maybe even the supalonely one,10
739,"9 new recoveries in New Zealand totaling 83 in this place. Already 178,099 worldwide. coronavirus covid19 NewZealand",5 8
740,Hello World . April Fools! jk - China CCPVirus coronavirus COVID19 COVID19 Wuhan,10
