1,NO JOKE I WILL HOP ON A PLANE RN! (Well after COVID19 lol),0 10
2,BanMediaHouse whose is responsible for spreading Fake and communal Stories in this pandemic Corona situation.,6
3,Im waiting for someone to say to me that all this corona thing is just an April fools joke,3 4
4,He is a liar. Proven day night. Time again. Lies when the truth will do. COVID19,6
5,"NEW: U.S. CoronaVirus death toll reaches 4,000 after nearly 900 new deaths were reported today (BNO News) Covid19 CoronaVirusOutbreak",8
6,"Coronavirus impact Govt extends I-T deadlines related to Sections 80C, 80D",5 8
7,"42,000 people might have died in China from Covid19 but China was underreporting according to sources.",6 7 8
8,"Dear Chinese! Kindly cook your bat thoroughly next time. Regards, COVID19 CoronaVirusUpdates CoronaVirus",5 10
9,This is how the govt of kenya is checking the temperatures of COVID19 and saying it is still low. Mtashangaa sana.,3 6 9
10,"My mental health hasn't suffered at all under the coronavirus quarantine! Ha-ha, April Fools.",10
11,i cannot die before watching a concert live corona virus pls try to understand,5 10
12,"you are a complete wanker, and I hope you die from coronavirus. You're a fucking dickhead.",6
13,Has anyone elses FB ads been killing it since this coronavirus hit?,0 5 10
14,"Just heard that my Oncle in France has the Covid19 and is now in a coma in critical condition. Guys please this aint no joke, be safe",4 5
15,That moment you realize your new medication has side effects identical to corona virus symptoms how will I know?,4 9
16,books and wine are two of the greatest pleasures. Perfect for seeing us through covid19. Stay safe.,1 10
17,"Three teams are fighting Covid19 day night: 1: Doctors, Nurses, Policemen. 2: Khans PR team. 3: IT cell",0 1
18,"Six new coronavirus cases reported in Karnataka, taking state's tally at 181 CoronavirusOutbreak CautionYesPanicNo",8
19,Watch the government play off Corona virus as a big April Fools Joke,10
20,"A lot of chatter about 16000 staff for the Nightingale Pop Up Hospital, but where are they coming from? Covid19",4 7 9
21,if i dont survive this corona virus pandemic then just know that it was that dumb bitch carole baskins that killed me,3 10
22,Anyone have a good roundup of what the countrys billionaires have done to respond to the coronavirus?,6
23,"CORONAVIRUS TRUMP Wed, 1 Apr 2020 00:00:00 CDT",0 8 9
24,what's the procedure for corona testing guys?? the whole village needs to get tested A.S.A.P..,4 9
25,"My folks ordered pizza and now they doing the most to make sure its corona free, bitch why did yall order pizza then",6 10
26,"I wonder what's gonna come next, first Kobe and now Corona... What's next?",3 6
27,The problem of poverty has now covered the cover of religion. The issue has changed. There is relief from corona. All is well,0 4
28,envious of pigeons poo brains 2day. they dont worry about coronavirus cos they dont have any thoughts,4 10
29,Pushing the free therapy for health care workers when this COVID19 Arc is coming 2 an end.,1 2
30,PLEASE bring back AllAmerican whenever this corona over Im begging you,10
31,Emergency warning signs for COVID19: -new confusion or inability to arouse thatcouldmeananything but -bluish lips or face thatsjustscary,4 8
32,"I hope this corona virus was one big ass joke, good one world",3 4 10
33,"neighbours, if u can hear me coughing, it's because my water went down the wrong hole and NOT because I have corona",10
34,Corona its like a strange unreal horror movie everybody out there stay strong stay home and take care much love for all of you,2 5
35,Western countries busy in fighting against Covid_19. Result: terrorisme stoped world wide.,0 6 7 9
36,Im not a conspiracy theorist... But why did China set off a bioweapom (coronavirus)? And how are they profiting off it?,7 9
37,Those white butterfly clearly gave us a clear signal that something bad is going to happen.... Corona Virus.,3 4 5
38,So when is corona gonna say April fools its the 1st already,10
39,Never heard or seen a better thing for this Corona curfew enforcement,0 1
40,And now we get to play the guessing game - is it allergies or might I have already given my wife a deadly illness. COVID19,4 10
41,Do you know whos also at risk for the corona virus? People who live in apartment buildings,4 6 9
42,"My masks arrived finally, from Hong Kong, washed the masks twice in dettol! No such thing as being extra cautious! coronavirus",4 10
43,"CoronavirusUpdate 38 coronavirus deaths in India, 1,637 positive cases. CoronavirusOutbreak",8
44,Mr Amir Khan should also come speak to fellow Muslims to obey medical necessity to fight Corona.,0 6
45,"Me and Elise have been trying to hang out around our schedules, and then corona came by and fucked it all up",5 10
46,"Sooo, *has* anybody made a fan OC of COVID-19 for the Cells at Work world?",0 6 9 10
47,ChrisCuomo weeping for us all coronavirus Pray FirstResponders QuarantineLife family faith,2
48,"Michelle: Im gonna take a nap, wake me up when corona is over *earthquake happens* Me: Damn God said Ill wake you up now",4 6 10
49,PTI_News: COVID-19 toll in Maharashtra now 12 after death of two more coronavirus positive patients: Health official,8
50,i blame the coronavirus on Wal-Mart no longer being open 24/7. life was good before they implemented their new hours,5 6
51,N ofcourse theres a Hyperstick right now on ebay for 75 shipped COVID19 fucking up my swag right now,6
52,Make corona finish,0 3 4 5 10
53,By the end of this COVID19 crisis Im determined to be able to speak coherent Romanian. Then Im moving on to German with a friend.,0
54,my parents are being so over dramatic about corona. like grandpas lived long enough.... chill,6 10
55,Satellite images show decline in air pollution over Italy amid coronavirus lockdown.,0 5 8
56,Wacha hii lock down ya corona iishe is the new I'll let you know by ladies.,3 10
57,"What coronavirus is he talking about? The one that's been around for 1,000's of years or Novel COVID19?",6 7
58,someone threw a corona virus party with 40 people in a 550sft apt with a whole ass dj in there..,6 9
59,Need to get my sleep schedule together if corona decides to get better and I gotta go back to work no? Ok.,10
60,True. Human rights says alot regarding the disposal of the deadbody.! lka COVID19,0 1 9
61,Im working on a new blog about how COVID19 is changing collegiate learning. Heres the at-home setup.,0 5 8 9
62,i think its time for you to announce that this corona shit was an april fools prank thanks,4 10
63,The Coronavirus is a good lesson and reminder that the American people need a new government and a reliable source of information.,6 9
64,Blue check fakenews CNN talking head angry that Okeefe does actual on-the-ground journalism on covid19,6 8 9
65,"Only getting on to say I have had my corona break down, Im not having a good time, and Im ready for it to be over And I miss Bailey",5
66,When I get my hair braided after all this corona shit its over for yall n words.,0 6 10
67,corona Arora is really a beemari My X-wife is Arora...,10
68,"Im such a hot ass butch rn! Thanx to corona my style, music taste and lifetstyle is IT! Thank you smh sending a post card!",6 10
69,Imagine this corona virus stuff was all an April fools prank say sike rn porfa,3 7 10
70,If anyone can tell corona to fuck off... proceed to do so cause a motha fucka bores out of his mind!!!,6
71,For real though can fsociety or MrRobot wipe out everyones debt during this COVID19 booochet?! Much appreciated yall,0 4
72,jaejoong baby theres a trend in jp not to spread lies about corona this april first n that includes lying that you have it,6
73,Eugenics George Soros Bill Gates Partner with China on Coronavirus Drug!,6 7 9
74,Sometimes Im minding my business and then all I hear is Cardi B saying Coronavirus,6 10
75,ORANGE CHICKEN = CHINESE FOOD CORONA VIRUS = YOU CANT CALL IT THE CHINESE VIRUS BECAUSE THATS RACIST. PLEASE HELP ME UNDERSTAND.,6 10
76,"I dont care what anyone says, COVID19 is definitely because decided to remove",10
77,can corona virus today just say HAH its been an april fools so we can all wake up tomorrow to a semi normal world again!,0 3 10
78,Omg my brother on his game arguing with somebody telling them thats why they got coronavirus these kids crazy,6 10
79,"I was doing so good, eating better and finally losing that birth control weight then boom, corona quarantine snacking boredom.",5 10
80,I swear if ANYBODY tries to pull an April Fools prank in this Coronavirus chaos....,6 10
81,The man says it like it is. Listen to him please. Follow his advice. coronavirus COVID19,0
82,"Due to Corona, we officially have three days of the week 1. Yesterday 2. Today 3. Tomorrow QuarantineLife",5 10
83,Corona virus ruined my senior year its ok tho Im making the best out of it,0
84,Me: what are you up to today? Dylan: the internet covid19,9 10
85,jan: ww3 feb: australia wildfires march: corona waiting for the next thing 2020 gonna throw,3 9 10
86,"So the wait is finally over in India guess what, Corona has found its religion.. Happens to be Muslim virus",3 6 10
87,Once this corona shit is over Im deff getting a on my butt cheek,0 10
88,Another year on this earth has gone by and I get to stay inside on my bday because Coronavirus being a hoe :-),5 6 9
89,White House predicts 100 000 - 240000 will die in USA from Corona virus.,8 9
90,1/16 CORONA VIRUS GOD DID IT ?? NATURAL EVIL GOD DID IT?? JESUS HAND WASHING?,9
91,I forsee a Real Race War in South Africa after this coronavirus. People's eyes and minds have been reconcietised.,3 4 9
92,"Breaking FoxNews Alert : Coronavirus death toll in US reaches 4,000",8
93,Fact:- The words Corona and Dalgona rhymes perfectly. Maybe this is the reason behind the trend dalgonaCoffee,9 10
94,Maybe he can release a revolutionary new app that for $9.99/month can help detect and contain COVID19,0 10
95,"Im scared to buy some weed, idk who corona filled fingers been bagging my shit.",4 10
96,"We need a stark reminder of the COVID19 challenges out there, we need to wake up and do better. 1/4",0
97,HERO OF THE TIME MURAD ALI SHAH PLEASE CHECK INCREASE IN THE CORONA VIRUS CASES YOU HAVE LEFT PUNJAB BEHIND BEST PERFORMANCE,4 6
98,polio ki tarah door to door Corona test ho...callme 8791777345,4 5 9 10
99,News updates from Hindustan Times at 9 AM: Coronavirus death rate lower than estimates: Study and all the latest news at this hour,8
100,I blame that beeitch Carole Baskin for the coronavirus. Putting me out of work she owes me a lot of money.,6 10
101,"8,50,000 corona cases :( Numbers keep on increasing COVID19",4
102,"My co-worker, who's friend in Italy tested POSITIVE to the coronavirus, then after 32 DAYS he got sick from it. NO SYMPTOMS for 32!!.",4 10
103,Meanwhile your Jeffrey Dahmer on steroids aka was doing sh*t all about COVID-19.,6
104,so long as there be diagnostics of coronavirus all vital opportunities of sectors cease Illuminatti,7 8 9
105,Anyone else hoping coronavirus is an elaborate AprilFoolsDay joke,9 10
106,Im finding it so stressful seeing names trending and clicking on them with dread COVID19 COVID19,4 10
107,please STOP LEAVING YOUR HOUSES AND TAKING THIS CORONAVIRUS STUFF AS A JOKE AND KEEP GOING OUT WITH FRIENDS AND STUFF SERIOUSLY,6
108,And apple wonder why they are hated. Best advertising campaign of the corona virus era,10
109,DANG!!! I officially know someone that has tested positive for corona virus OML,4 5
110,Were going through some biblical grade end-of-times shit rn. COVID19 IdahoEarthquake LocustInvasion,3 4 5
111,"31 March 2020 Confirmed: 75,122 Deaths: 4,525 coronavirus",8
112,Smoking Bluntz To Da Neck Vioce Rings In My Head Coronavirus besafe,10
113,This COVID19 quarantine has seen women rise to men's level in the thirst stakes. SelfIshoelation,3 10
114,Got a movie theater sized jack and coke since we gonna die anyway COVID19,3 10
115,Ur Director a TOTAL IGNORANT that missled the world ABOUT CHINA'S CORONA VIRUS! IS KILLING 000's WORLDWIDE! fired the incompetent!,6
116,So whos ready for everyone and there mother saying coronavirus isnt real April fools,6 10
117,"Chris, this is no time to get sick. Come on man, kill the Corona and come back on screen. Hurry up. BEST.",0
118,i would take a razor scooter to the ankle 50 times if it meant the end of corona,3 5 10
119,How cavalier politicians can be with people's property in the unfettered competition for the credit for saving their lives. coronavirus,6
120,Covid19 lockdown situation is like our own 'existential crisis' hanging over our heads.. PMKcallsCurfewExtension,4 5 9
121,One things for sure: Corona Virus has been really good for the environment.,0 1 9
122,I was supposed to go to Europe this fucking June and fucking corona took a big shit on my trip. Oh my god,6
123,Started buying the large bottles of wine so I wouldnt have more empties than I have days in quarantine strategies COVID19 WorkFromHome,0 3 9 10
124,"Welcome to April, I hope this will get better soon, Covid19 soon disappear from the earth.",0
125,bhilwara-has-become-a-global-role-model-by-breaking-the-corona-chain-with-efforts-made-by-the-state-government,1 8
126,"Asuma White House projects 120,000-240,000 coronavirus deaths in the US......",5 8 9
127,"busy busy busy, so many things to do, pandemics create work. no doubt COVID19 DigDigDig FundsFundsFuns",0 9
128,What do COVID19 and have in common? With no remorse theyll take your last breath or last dime.,5 6
129,"Friends of a certain age, am I the only one playing the Is it a fever or is it a hot flash game? COVID19 ThisIsATerribleGame",0 5 10
130,Hoping that China says the CoronaVirus was an April fools joke haha,10
131,In what world do you think making a joke for April fool about the coronavirus is OK???,6
132,"Are we sure the symptoms of corona virus arent bloating, weight gain, and alcohol poisoning?",10
133,Is there any e-commerce / delivery service working in Delhi for food items ? COVID19 CurfewInIndia Delhi,0 3 7 9
134,Still waiting for God to tell us this was all a big April Fools joke! Pls maybe? COVID19 CoronavirusPandemic AprilFoolsDay,2 10
135,"2020Diary 92/366 Hello world, today's April mop. Please tell me immediately, that Corona is a lie.",0 3 10
136,Thank god coronavirus hasnt stopped new K-pop,0 1
137,So relationships now go be like : would you like to get tested with me? : Corona or AIDS? : Corona first !,3 10
138,WHY ARE U USING COVID19 AS EXCUSE TO NOT GIVE SCHEDULE TO GOT7 WHEN OTHER GROUPS CAN???????,6 9
139,Chopper out during corona virus lol south central does not sleep or care smh,10
140,More free time bc corona and I STILL cant seem to figure out how to respond to ppl on bumble. I NEED HELP.,5 9
141,Deaths in Kenya: Coronavirus 1 : 2 Curfew to protect against spread of COVID19,1 8
142,"Corona has killed 1,the police already killed more than 2,.. And we call it prevention",0 3 6
143,Sigh. So from 1 to 224 within one month. Its been a long month. March 2020. coronavirushawaii,3 5
144,"Remember also not to touch your face in places like mouth, nose qnd eyes since corona virus enters the body via those parts jumiaheroes",0 9
145,Coronavirus cant kill Gods amazing sunsets every night !!,0
146,This is why I never made children...too much is wrong with this world Covid19 climatechange climatejustice cometaAtlas,3 4
147,This kills me...If I have to get tested for COVID19 Im gonna asked to be put to sleep...Im serious.,4
148,"Corona was a big early April fools joke haha, I get it haha.",10
149,"In between depressing CoronaVirus news, this was such an uplifting tweet! Welcome back Stabler!!! DUNDUN",0
150,Actually this year Corona is celebrating AprilFoolsDay by making all of us fool,5 10
151,Okay its april fools day can coronavirus say sike already,10
152,I thought April Fools' cancelled 'cause Coronavirus,10
153,"Really? Whats bidens plans for the corona virus in detail please, mr facts.",6 10
154,Its the ending the world. Send nudes to everyone you slightly like. Risk it before we all die.- COVID19 COVID19 coronavirus,9 10
155,I hope farting isn't among symptoms of Covid19 because the rate at which I have been farting since last week is alarming...,4 10
156,Very well said. Something good is also happening with COVID19. Let us make full use of it.,0 10
157,Anyone making jokes about getting corona will gwt these hands yep yep same with coming out jokes bye,6 10
158,Mile 12 Market will remain open. Farmers can still supply their fresh produce - COVID19 Mile12Market,0 8
159,"Judiciary is biased, impressed by anti Hindu, anti National media. Also Jail is not safe for prevention of corona. CoronaRiskForPrisoners",3 6 7
160,"the ministry of health, labor, and welfare sent me a survey on LINE to see if i might have coronavirus",1 6 9
161,You KNOW he ready to box the first nigga that make a coronavirus joke about him,10
162,"106 new confirmed case(s) in Austria totaling 10,298 in this place. Already 860,035 worldwide. coronavirus covid19 Austria",8
163,u cant just create an april fools joke on corona virus man.. ppl actually died bcs of it wtf,5 6 10
164,2020 sucks. Is there any good news? Anything good happening? Anything at all? coronavirus CODVID19 QuarantineLife,3
165,Gonna be deadass Ive got coronavirus jokes all day instead of the classic pregnant jokes enit. smh might sleep all day to avoid it,6 10
166,speaking of my daddy were probably not meeting in may because of stupid corona :(,5
167,Corona virus is helping the environment - Air on Earth is now getting cleaner,0 1
168,Is the corona going to prevent the rupauls drag race season finale from happening or????,3 10
169,"CoronaVirus must be Fought by everyone collectively ,not by deviding us on Religious line Muslims Islam",0 5 6
170,Today was okay I feel good about myself but the corona virus and job searching is really hard for my mental health,4 5
171,. colleagues talk about human rights-based responses to COVID19.,4 8 9
172,The biggest coronavirus fails right now are the USA UK governments.,6 9
173,Just a reminder...Kanika Kapoor was called Corona Kanya... Nobody had issue then?,6 10
174,Florida and Texas (among others) need to start to act NOW. coronavirus CoronaUpdate,6 8
175,It's called Islamic Corona jehad tablike jamat making full to all India during lockdown they are relizius terurrist,3 7
176,a few of my thoughts on the coronavirus: 1. Im gonna drink a bottle of wine 2. Lets review 1,6 10
177,Dis Corona of a tin na scam oo na competition country dey do o any country with the highest Corona cases world bank go give Dem money,6 9
178,on CNN Cuomo--economic expert Alexis Glick talks financial--the difficulties Americans are experiencing b/c of Coronavirus,8
179,Is it me or they just sitting back letting the corona cases deaths rack up ?,4
180,tomorrow in the news trump is gonna be like april fools the corona virus isn't real,0 10
181,Ima just be waiting for someone to say April fools Coronavirus was a just a joke tomorrow,10
182,One of the more important questions not being explored - how long does Covid_19 live on fake fur?,3 4 9 10
183,Implementing the Coronavirus task force and banning travel. Nice try sweetheart,6 8 10
184,"Only time imma stress corona is when Waffle House closes down, until then, bitch imma get me a waffle",6 10
185,Lmfao idk how yall do it my sister and bestfriend my happy place lol shit we gone corona together atp,10
186,it's 7:39p and i feel like i just woke up 2 hours ago :') i hate it here .... can this coronavirus just go away :(,5 6
187,"Every state, county, city and neighborhood has this coming at them. Yet many still wait to act COVID19US",1 4 6
188,Wouldn't it be wild if this whole pandemic were just a big April fools day prank? AprilFoolsDay COVID19,0 9 10
189,Once again PLEASE be careful and be safe especially with the coronavirus going around!,2 5
190,Do not use twitter for nothing. Pl Focus on CORONA VIRUS Help Needy citizens Peace Peace Peace,0
191,Just talked to my doctor friend and apparently the number one way to get the coronavirus is from tainted toilette paper. So thank you karma.,4 6
192,Are you being sarcastic? Trudeau gov disaster Liars Trudeau gov allowed coronavirus to spread in Canada.,6 7
193,Corona patient recovered at a private hospital. His employer footed the bill of Rs 12 lakh.,0 8
194,March has come and passed COVID-19 seems to forever last Wake me up when April ends covid19 COVID greenday,3
195,I miss singing my heart out at church every Sunday :( corona GO AWAY,5 6
196,What if they opened saga back up after corona. I think we need a petition,5 6 9 10
197,"No, anti-vaxxer mom in my fb feed, Bill Gates is not going to to fucking inject people with some corona virus microchip implant.",6 10
198,Risked getting corona going to the store just to buy modern warfare 2 campaign remastered!! :),4 10
199,It's come to my attention those on AusStudy don't qualify for the Coronavirus supplement for each fortnight. Students bent over again,4 6 9
200,Covid19 please end soon as possible i wanna meet my bebe and my family,5
201,Listen to granny and do as you're told yer selfish twats! COVID19 StayAtHome SocialDistancing,1 6 10
202,This was is a hell of a way to kick off the NewDecade FactsMatter COVID19 TrumpIsAVirus TrumpLiesPeopleDie AllInThisTogether,6 9
203,Happy April fools yall Please stay safe and be sensitive to the situation- Aka dont make any COVID19 jokes,0 6
204,"Does anyone know if Russia, Syria or North Korea has the corona virus? Not hearing anything at all about those countries.",9
205,Finally after roaming around the world Corona accepted Islam in India. IStandWithTabligiJamat Islamophobicindianmedia,0 10
206,"240,000 will die from the coronavirus IF were lucky. IF. Think about that!",3 4 8
207,if i have to hear the word corona one mo time im beating somebody ass,6
208,"Giliran corona, harga hotel murce2. Pen staycations aing",5
209,Just spoke with a doctor. Another confirmation that we have a cure for the Coronavirus. 100% effective,0 1
210,do yall think canva updated their logo because the other one looked too much like the coronavirus lol,0 10
211,COVID19Pakistan: Ulemas asked to abide by governments coronavirus-related instructions . LockDownPakisan,0 1 8
212,"So apparently over 710,000 people die from the corona bars thats some crazy stuff right",3 4 9
213,"When Xavier Wulf does an Attack on Titan tape like he did Project X for Initial D, the coronavirus will officially disappear",10
214,the inflammation of the lungs is what kills u. corona virus. My dad had walking pneumoni. I know this,0 10
215,some people are dumb acting stupid because corona cant easily kills young adult huh?,6
216,lol in Aprils 1s 2018 my doctor told me I have one year to live nigga i made to Coronavirus 2020,0 10
217,Let us not forget the coronavirus primary double speak,0 6 9 10
218,my twang is getting so fucking bad we need to cure corona immediately so i can stop hanging out with my family im begging,6
219,This corona virus pandemic is going to leave more people bankrupt than dead.,3 4
220,"Keep your mask close, keep your sanitizers closer. Mario Puzo Covid19",4 8 9
221,I am not going to die from COVID19 I stopped tuning in 4 days ago.,0 6 9 10
222,I wish to make a cash donation to help stop the speed of corona virus. How may I do that please,0 1 9
223,April Fools everyone! It was just a really expensive joke haha the coronavirus isnt real go back to your lives Is what I wish would happen,10
224,How much longer til life goes back to Normal from COVID-19? coronavirus,0 4 5
225,I really dont think it's appropriate to joke about corona at a time like this,2 6
226,China and made the whole world AprilFools through their false reports of no COVID19 spread in December/January.,6 7 9
227,cc: and all the morons who support her peddling of a drug untested to fight COVID-19.,6
228,How are we supposed to know we are sick..more complex things to come.. COVID19,4
229,Yup. Sigh. RT People concerned about Benghazi but not about ineptness in COVID19 amaze me.,3 6 10
230,Every nurse/medical professional on the frontlines of the COVID19 crisis should be getting hazard pay. Its crazy that so many are not.,1 8
231,can groundhogs get coronavirus I am worried about Gus the second most famous ground hog in pennsylvania,4 6
232,These young niggas out here dying from that Corona because they immune system aint strong enough from donating all that plasma,5 10
233,Next year in Jerusalem - with homemade gelfite fish and a world that has a Coronavirus vaccine.,0
234,well its officially april 1st and no one has come out and said this whole corona thing is a joke,3 5 9
235,the reason coronavirus is spreading so fast is because its trying to outdo idpol as the 1 plague currently ravaging the world,4 10
236,BREAKING: Tablighi Jamat donates 2100 Coronavirus patients to PM Relief Fund.,8
237,Government gone fuk around and say April fools bout corona on da 1st quitplayin,10
238,No April fools day here. 2 work colleagues have died from this Coronavirus. It aint no joke. RIP,5 6
239,"Ok we get it, April fools haha can we say corona was a joke now",10
240,Have I mentioned how infectious this virus is? 1/3 of this nursing homes residents died of COVID19,5 8
241,"RIP to the 200,000 beautiful souls that were already taken by the coronavirus P L E A S E stayhome SocialDistance SixFeet",2 4
242,"It aint sitting right with my spirit how Dr. Joseph Lowery wont get the proper funeral he deserves. F*** corona, fa real!",6 10
243,CORONA VIRUS QUESTION: Can you get the virus by smelling a fart? Some of them MFs travel farther than social distancing! CautionYesPanicNo,4 10
244,if you like my comment it means you think the chinese deserve the corona virus,6 7 9 10
245,Nasa has put on a few pounds during this Corona Virus period. My mum is feeding them every hour aki.,0 10
246,Checkout page he has good content and raw footage on his Twitter page. coronavirus COVID19,0 8 9
