3248,ALERT: 40 new COVID19 cases have been confirmed across Queensland.,8
3249,ok so tom holland is trending on twitter i stg if i open that hashtag and he got corona og i will ball my eyes out,3 4 10
3250,Corona virus increasing patients number very fast try to control it seriously very fast don't play with the people's life,4 6
3251,please stay home unless you really need to go out. Covid19 IS active in Perris,0 9
3252,I lost two nails today what else do corona want?,3 5 10
3253,fuck the coronavirus knackering c*nting basterdin wankerin tr*mp of a yolk,6
3254,"After Corona virus and Hanta viruses, now the parasite, WTF is wrong with these Chinese people.",6 10
3255,by the time shit corona shit over my tat on my finger gone be faded from me washing my hands so much,5 10
3256,my mom is calling all our relatives to tell them that coronavirus is real ok kylie jenner,6 10
3257,Oh if it werent for corona Wed all be in Sonoma Getting wine wasted Not bat flu tested!,5 10
3258,To all the people saying what are we gonna talk about after corona ends... economy idiots.,3 6
3259,This corona shit jive ruined half the stuff I had planned this year and this is really gonna be a set back for me,5 6 10
3260,"Coronavirus outbreak in India: From 1 to 2,500 cases: 9 weeks From 2,500 to 5,000 cases: 6 days CoronaUpdate",8
3261,lol corona virus is fake the government pulled a funny april fools prank haha XD,10
3262,So ... since probably gave Bernie Corona ... is this DNC rigging or Fredo being Fredo?,6 7 9 10
3263,Finally some good news ChinaVirus ChineseVirus COVID19. . and much China and dirty Chinese.,0 7
3264,First time leaving the house in so long. Gas is 1.33????? Corona acting a bit naughty lately,5 6 9
3265,Bigger debaters/pundits arguing in bad faith: Hugh or Rich? coronavirus ConservatismisDead,6 7
3266,RT Would love to hear Dr. Birx or Fauci discuss face masks. coronavirus,0
3267,Cant stop thinking about my plant that has been in my dark office unattended since March 12th. Thanks COVID19,5
3268,ok april fools now government u can tell us corona is a prank now,0 3 4 10
3269,A 25 year d died of the novel coronavirus and had no pre existing conditions,4 5 9
3270,"alright fine, fine. it's true. im tired of doing a tik tok dance every day until corona is over so please can there be a cure already",0 3
3271,"a great resource for prevention and dealing with the virus, delivered in plain language COVID19 FlattenTheCurve",0
3272,And please dont do the I got the coronavirus pranks that shit gone be so lame,6 10
3273,If she can give his son R1m for a music video clearly she can donate more to the Covid19 Day6OfLockdown,5 6
3274,Hey arent you tired of talking about coronavirus every goddamn day??,5 6
3275,NowPlaying Unknown - PRED EN DIRECT DU 20 03 2020 CONTRE CORONA .mp3,8 9
3276,If theres one thing corona has done for me its that it taught me that I cant take online classes,3 6 10
3277,Im happy corona eliminated the chances of a Tiger King press tour tbch,0 10
3278,Its 2021 just to say that 2020 had gone and year full of happiness and corona free is back AprilFoolsDay,0 10
3279,They could've at least used mannequins - Kacey covid19 lies,7 10
3280,i dont wanna hear any jokes about corona being gone tomorrow for april fools pls,6 9
3281,I'm going to just say it now.. I'm not in the mood for any April Fool's bs this year. Too much going down! StayHome coronavirus COVID19,6
3282,Were going to be seeing corona themed porn about fucking your landlord cuz you cant pay rent very very soon,6 10
3283,"B.S.,he was playing golf right through, and GOP freed him in plenty of time to prepare for Covid-19 FAIL!",6 9
3284,"I just wanna know something, which one of you going to beyond has tested positive for corona yet?",6 9
3285,Breaking news: The corona virus was just a badly timed april fools joke gone wrong,10
3286,World is busy in fighting COVID19 penedamic n India is busy in changing the demography of Kashmir WeRejectDomicile,6
3287,"good morning all, is the Coronavirus a biological weapon created for de-population???",4 5 7
3288,28 new cases of Coronavirus in WA. We have 14 in ICU in total. COVID19Aus,8 9
3289,Jan. Flashback: Dr. Fauci Said Coronavirus is not a major threat to the people of the United States,0 8
3290,I heard 3 different remedies for corona virus today / yo dont believe everything the internet has please.,0 1 9
3291,So happy to see that this list grows and expands. Good job . covid19,1
3292,"aint nun to tweet bout now. cheers corona, sons crying now",5 6 10
3293,$MBRX Announces Active Compound in WP1122 Reduces Coronavirus Replication In Vitro by 100%,8
3294,"This corona virus is easy for foot guys like myself. Six feet for everyone? Please, say less",10
3295,Let us call on God and believe together for the cure of corona!,0 2
3296,I never thought I would be watching television while my mother looks at Coronavirus memes on her phone.,5 10
3297,"Hi, just a reminder that for Aprilfoolsday2020 don't be a jackass and joke about having the coronavirus. It ain't funny, y'all.",6
3298,"Thank you, China! And on top of that they sold the world non-working Coronavirus tests and defective facemasks.",1 7 9 10
3299,Im finna get a condo soon as this corona shit over Stg,5 6 9
3300,So proud of helping fight our war on coronavirus and protecting Americans in a different way!,0 1
3301,Indian media and IT cell is so great that they can even prove that Corona virus (Covid-19) originated from Nizamuddin and not from China,6 9 10
3302,waiting for someone to say april fools and this coronavirus shit to be over,0 10
3303,Government about to say this Coronavirus mess is an ugly April fools joke,0 3 10
3304,Crisis is the breeding place for creativity. It will force you to become more cutting-edge and resourceful. COVID19,0
3305,Fellow ICs - Have you noticed a change in number of STEMI patients in your hospital since COVID19 Pandemic? pls RT/Comment below,4 8 9
3306,what's with Illegal border crossings and lawful travel drop amid coronavirus restrictions,6 9
3307,Basically it's a announcement that old and poor are already dead even before infected with covid-19.,5 6
3308,Happy rent and bills due date everyone haha joking April fools coronavirus,10
3309,I know that bitch from high school that shoved a hot dog in her pussy got corona,5 10
3310,Im ready for war over this coronavirus shit.. China might have to go frfr,6 7
3311,Don't buy accept anything from outside. It's NOT safe. Its can hold Corona viruses. Stay home with only belonging things.,4
3312,"Anyone questioning our publicly doubting the severity of COVID19 will be blocked, de-platforming stupidity is important too.",6
3313,im staying inside cos im scared of the coronavirus test. im not even scared of getting it. just scared of the rod they put up ur nose,4
3314,I hope to wake up tmrw to see that this corona shit is all just a joke,0 5
3315,Some of the twitter accounts sharing their stories of having COVID19 are fake... dont get clowned,6 8
3316,You know whats crazy I aint hear nun bout niggas in Haiti with corona,4 10
3317,Its already April. I wish this whole corona thing was an April fools.....,0 3 5 10
3318,tmw im just gonna tell my mom or someone that my friend got corona then say april fools,10
3319,CoronaVirus is contagious through spit that should level up the charges to something more serious than assault.,4 6 9
3320,I knew you guys would trend Burundi until they get a Covid19 case now see they have 2 cases. coronaviruskenya TheLockdown,4 6 8 10
3321,This rain should please help us wash Coronavirus away. Dakun,0 2
3322,"4 new death(s) confirmed in Ecuador totaling 79 in this place. Already 42,106 worldwide. coronavirus covid19 Ecuador",5 8
3323,Many rural students dont have Internet access. Please forego the tech and just call. Covid_19,4 6 9
3324,Many Americans journalist must get their head out of the azz of China if theyre going to report on the COVID19 with accuracy.,6 9
3325,COVID-19 toll in Maharashtra now 12 after death of two more coronavirus positive patients,5 8
3326,"quick side note, if all of you healthy people pranks by saying you got corona, you're a fucking dick",6
3327,Take the poll and let us know how has COVID-19 affected your life.,5 9
3328,Hi can someone put me in a coma and wake me up when all this virus shit has ended? Okay thanks COVID19,4 10
3329,"Police attacked with stone, by the Tabrighi Markazi in Bihar. Any doubt left that Islamist are on Corona Jihad?",6 7
3330,Don Lemon just asked Chris Cuomo if he got his gift; says I sent you a six pack of Corona.,10
3331,breaking news: coronavirus quarantine is killing the shampoo industry! yall be looking greasy as fuck!,6 10
3332,NIZAMUDDIN CORONA. Every participant is aware of risk wearing mask. Then what is the strategy of some of them spitting thru Bus windows.,6
3333,"Corona doesn't move, people move. To stop Corona spreading, stop people moving. Stay home, social distance, wash hands.",0
3334,"Born amid COVID19 crisis, two babies in Andhra Pradesh ... CovidIndia CoronaIndia",8
3335,Tomorrow the governments gonna announce corona virus was just an April fools joke and we can all leave our houses now right,9 10
3336,"Ah, and there it is. The first specific call for Coronavirus stories I've seen. Brace for impact! amwriting writers WritingCommunity",1 3 5
3337,"So Coronavirus was just one long April Fools prank right? 2,387 127K 859K",10
3338,wine drunk watching a corona infected Chris Cuomo broadcast from his basement...,0 10
3339,"Stay at HOME. WASH YOUR HANDS. DON'T TOUCH YOUR EYES, NOSE AND MOUTH. NO HUGS.... NO HANDSHAKES BE CORONA FREE",0
3340,Wow Showed footage from a left wing program coronavirus They must of showed some truth for once.,6
3341,Feeling like the corona virus the way nobody want me,5
3342,corona isnt a thing to be joked about thats not how u raise awareness,0 6
3343,April fools about to hella ass tomorrow. i got corona HAHAHAHA so freaking stupid,6 10
3344,which youtuber is gonna fake testing positive for coronavirus and have to do a crying apology,6 10
3345,5 Coronavirus positive cases reported in Ongole. Now 63 cases in AP,8 9
3346,"Luckily, I sold my Toyota Corona bought a Corolla!!! coronavirus",1 10
3347,"... a once in a lifetime opportunity to stay in the house, sit on the couch, and watch TV. COVID19 LarryDavid",0 1
3348,Trumps new lie is that hes the Corona Whisperer and he alone saw and acted before anyone else. Guess what? MAGA will believe it.,5 6 10
3349,"Just like chlamydia, corona virus can show little to no symptoms. Go see your GYNO you nasty bitch.",6 10
3350,"Remember hand sanitizer can make your hands dry, so don't forget to moisturise! COVID19 SARSCoV2 nCoV19 HcoV19",0 9
3351,"Whoa. US posts 23,175 new cases today 845 new deaths today. COVID19. StayAtHome",8 9
3352,Lol dude started listening/heard people talking about Burna 2018. Spread ur ignorance like Coronavirus...,6 10
3353,Just Imagine Corona Virus Let Yll forget April Fool..!! Tooo Hard ....,5 10
3354,IMPOTUS45 accepts Corona aid from Russia. Let's world know America is unprepared for crisis.,3 6
3355,"The LORD God said, Let the government of new york roll out measure to combat coronavirus.",10
3356,"Good safety measures for under age 2 kids, please keep them safe from this danger COVID-19",0
3357,"Modi testing the waters of free speech, it will start with coronavirus and there is no end.",4 5 6
3358,Coronavirus checks somehow managed to fly through Congress. Slavery Reparations: still pending,0 3 6 9 10
3359,"me and mal literally got new cars a week within each other, bitch we making big moves avoiding miss corona. Big blessed over here",0 10
3360,Of course the classic Ghost bundle and MW2 Remastered comes out while I'm broke thanks to my nonessential status. Fuck coronavirus.,6
3361,More Americans have died of Corona than died on 9/11. It's clear what we must do: invade Iraq for some reason.,6 9 10
3362,I want to go get Doritos but I'm in quarantine (I probably have the coronavirus),4 5 10
3363,So I keep hearing that COVID19 is causing gastro issues for some age groups. Dont tell that to the TPhoarders,6 10
3364,AprilFoolsDay German Department of Health asking people not to make up stories about COVID19: Corona is no joke,4 6 10
3365,Potso ke gore: Do you want to fight Coronavirus and how do you intend to do so? ~Mr Speaker,6 9 10
3366,April fools corona virus was just to keep us inside so the government can change the batteries in the birds,6 7 10
3367,Is covid19 the same like when Thanos snapped his fingers? World cleansing? coronavirus Marvel,6 9 10
3368,Shout out to all my friends working in the medical field throughout this whole corona thing man. Cant thank you guys enough,1
3369,"Wuhan coronavirus pandemic is like a biological war, We must fight it at war level.",0 6
3370,Let's mix the coronavirus vaccine with the MMR vaccine. Anti-vaxxers can decide then if they accept the science or not.,3 6 10
3371,"Donald Trump's tweets make me think coronavirus isn't real, he's very calm.",1 3 7
3372,Captain of U.S.S. Theodore Roosevelt Pleads for Help as Coronavirus Spreads Onboard.,4 6 8
3373,"Let's all agree now, that guys coronavirus April fools joke isn't funny. Hasn't happened yet but... you know.",3 6
3374,13 year old died from COVID19. Us young people should not think were invincible. StaySafe,3 4 5
3375,Nic Cage is gonna star in a straight to DVD Coronavirus movie,10
3376,How long should a box of wine last for one person during a pandemic? askingforafriend pandemicrules COVID19,3 10
3377,Lmaoo Ive had no propositions so no promises ... now when we was on the cusp of corona maybe 1,10
3378,Wine Pussy and a friend! Im a minor so grape juice and girlfriend guys lets cure corona I need me a babygorl,5 10
3379,Ill attend your coronavirus webinar if you give me a roll of toilet paper.,10
3380,Maharashtra Death Toll raise to 12; after death of 2 more COVID19 positive patients,8 9
3381,"Maybe, wear a scarf so nasty blood sucking pedophiles do suck on your neck, and then get coronavirus?",6 10
3382,AprilFoolsDay AprilFoolDay Don't try to spread the rumours of Coronavirustruth corona virus to celebrate April's Fool day..,0 5 6 9
3383,Mummy Trump bhai is not shaaaaaaring kinda case lockdowneffect Covid_19india,6 10
3384,Please join me Thursday to talk about resources available to deal with the Coronavirus and its economic impact.,0 8
3385,"Judging by the commercials on TV lately, restaurants were touching food way too much before COVID19.",9 10
3386,if corona passes by june-july summer 2020 is boutta be the best summer any of us have ever experienced. boutta make summer 16 look stupid,0
3387,Ion know whats more contagious catching the Coronavirus or being broke,0 3 5 10
3388,Speaking of Chinas information dissemination..... Peoples Daily reporting on the TR coronavirus outbreak:,0 7 8 9
3389,everytime things gets quiet or die down and im not giggling i think about this bitch Corona,3 4 9
3390,"If you thought the gym was packed on January 1st, just wait till COVID19 is over.",0 4 10
3391,"Turning the economy upside down to prevent Corona virus deaths, while letting known killers out of jails to commit more murders. Go figure.",6
3392,"If you're okay with the coronavirus being called the Chinese virus, block me right now.",6
3393,Dear corona can u pls leave us I really miss hanging out with my friends,5
3394,"may the humanitarian disaster caused by the Corona virus quickly pass from Indonesia, Amin",2
3395,coronavirus just hit home. My cousin who is a nurse got it and my best friends 90 year old grandmother. StopTheSpread,4 5
3396,"Ngl, I'm kinda sad that I'm not gonna have an actual birthday party this year, Corona really sucks.",5
3397,i fucking hate this corona virus shit for ruining my senior year,5 6
3398,Put a finger down on if your rent is due but you have zero dollars in your bank account because you got laid off because of COVID19,3 5 9
3399,"Total deaths in Italy and Spain from Covid_19 just hit over 20,000 and that of the world 40,000.",8
3400,Do you Want to Kill the CORONAVIRUS = Yes or No ? Well .. This is Best Hope for Everyone = if You want to LIVE,0
3401,It just updates me on the corona virus shit and its getting so bad/:,3 5
3402,im waiting for someone to tell me that the coronavirus was just an april fools joke taken too far,0 10
3403,"5 weeks ago- 15 corona cases in U.S Today- 163,539 EVERYONE PLEASE STAY HOME!",0 4
3404,"Good morning, cant wait for everyone to say hahah ah I got corona and then HaPpY fOoLs DaY",6 10
3405,"Time moves on, you can't hold on, you're not stuck in time, you're stuck in house btch hell u Corona",6
3406,here is an idea; let's sue China for sending us crap all the time. Now let's sue them for the Corona virus. THEY MUST PAY,6 10
3407,"This year in bizarro world, March came in like a lamb and came out like a corona breathing Dragon with halitosis and an itchy scalp",5 10
3408,Gaping hole in COVID19 journalism: the senseless killing of office plants around the globe.,8 9
3409,What would we even give corona afflicted nations at this point youre just scraping the res.,5 10
3410,I just hope I didnt give it to the kids. - Chris Cuomo after finding out he has coronavirus.,0 8
3411,"Thank you for following us. Avoid too much content on COVID19 , that stress can cause psychological issues.",0 8
3412,*at a party* Gale: *serving drinks* Dhani: Ill have a corona...hold the virus!! ;D Gale: Gale: listen here you little shit,10
3413,usa had more deaths in the last 24 hours due to covid19 than italy,5 8
3414,Corona virus exposes how we are forever spitting into each other. Humans are a bit disgusting entlik.,6 10
3415,its useless if it takes 24 hours to issue a corona pass for emergency duty. Where is the emergency??,4 6
3416,So lucky that he has over 9k new COVID19 cases in just the past 24 hrs...,6
3417,so my sister just told she has corona and idk if she fuckin wit since tmr is April Fools....,6 10
3418,Covid19 Hunger is real oh My DSTV remote just be like GALA for my eyes,6 10
3419,a Corona-induced Jimmy Buffett wet night terror,10
3420,Ah shiggty! tRumps main man has touched the hand of the Rona StayAtHome COVID19,4 10
3421,Corona has not only done threat to people's income but also Marriage Breakups.... let's watch all angles,5 10
3422,"Tomorrow is April fools day. COVID19 jokes are in bad taste yall... keep it funny, but not like... stupid.",0 10
3423,Stop corona virus! And Let's treat the world better than yesterday,0
3424,Gonna be so mad if I cant watch new movie cus this corona shit stopped it from coming out,6
3425,"Tbh this Corona shit doing all this cuz Im out with an injury rn. It wouldnt be all that if I was active, Im just different like that",10
3426,"Update COVID19 Week 3: ordered tampons from delivery! Came quickly, very successful!",0 1
3427,Due to the horrendous response by to the Coronavirus it shall now be called the TrumpVirus. COVID19,6 10
3428,I find it amazing that more people fear the Coronavirus than the Second Coming of the Lord.,9
3429,there are gonna be so many bad mixtapes coming out this summer... no i'm not ready to hear the corona sessions,3 5
3430,I just thinkning of some Asshole who actually gonna make an April Fool joke saying that they got infected by Corona.,6 10
3431,After Corona we really need to get our lives together!,0 5 10
3432,I hope the government tells us corona virus was a AprilFools joke tomorrow,0
3433,One American in every 8 minutes is or will die from coronavirus.,4 5
3434,my cousin who works at the cdc said if everyone throws away their copies of milk honey the gov will stop coronavirus,10
3435,The and are the Grim Reaper of the American people ... COVID19 pandemic coronavirus,6 7 10
3436,not sure if jaejoong knows joking about corona can bring him legal problems akdkdkd mf is just stupid,6
3437,bpak in a very very normal conversation : Isa ki kehidupan asmarane normal ra to iki? TOLD YOU CORONA IS A SERIOUS SHITT!!,4 5 6
3438,Franklin will be among the counties where the Guard will assist food banks. CoronaVirusUpdates,1 8
3439,imagine trying to tell people you have coronavirus but they all think youre just pulling an april fools on them,4 10
3440,"Corona virus is over, the economic crisis is over, people got their jobs back and Obama is the prezz AprilFoolsDay AprilFools",0 10
3441,"100,000 to 240,000 deaths. As the kind of best-case scenario. Oh well. coronavirus CoronavirusUSA",5 8
3442,Going to make shirts that day fuck coronavirus and sell them and 50% of what I get ima donate to help fight it.,0 10
3443,Wait so Burna boy just drop one statement and the whole TwitterNg just forgot about COVID19 ?,5 6 10
3444,If you are stupid enough to think 5G causes coronavirus then your are stupid enough to.... I'll let you work out the rest.,6
3445,Mhmmm i bet she like I wonder how that corona taste like ...,10
3446,Hey Coronavirus : Stay the fuck away from Betty White. Youve been warned.,10
3447,Why so much of religion used in this fight against COVID19?. Forget all differences and together we can win this pandemic.,0 2
3448,My bf decided fo grow out his mustache until this corona bs is over. God speed ladies God speed,3 10
3449,never thought id be working fast food again but thanks corona for putting me out of a job,6
3450,Waiting for the corona virus to tell us April fools yall thought,0 5
3451,good morning I have one question about blood plasma are you collecting any from recovered coronavirus patients?,4 9
3452,He died of coronavirus yall need to listen everyone ignoring this for Mississippi prison,4 6 10
3453,Coronavirus gonna come out and say April Fool's!! and then we can all get along with our day,10
3454,"its 37 minutes into april fools day and theres still no announcement from the government that corona is a prank,, what is this",5 6
3455,My babygirl is turning three Sunday and I cant even throw her a good birthday because the corona,5
3456,"What If corona comes out today and tells us, its all been a big prank. Camera hai waha hai, ab tum sab bhar aa sakte ho. AprilFoolsDay",10
3457,"How miserable a bhakt will feel, if a Chinese muslim woman develops the vaccine against COVID19 ! Fourth degree burn!",6 10
3458,Democracy at risk in India - using coronavirus as excuse the govt seeks to control freedom of the press.,4 6
3459,"Stay at home, save your gas. To beat corona, sit on your ass.",0 10
3460,Thanks COVID19! Now if u can make house market drop too thad be great !,10
3461,Okay corona its time for you to go !! You fucking w/ my 2week fill and pedicure,5 6
3462,stop. corona hurry tf up and leave florida so emily can get her breathin tattoo pretty pls. i beg.,0 10
3463,"Hey pupil, what is going on? Please stay home to be safe fom Corona.",0 2 4
3464,That corona virus aint gonna go away in La county anytime soon so long as all these businesses are still open.,3 6
3465,Am hoping this Covid19 quarantine will function like restarting a computer. Our society needs to be re-set. QuarantineLife,0 1
3466,How can you expect corona to go in a month that starts with April fool,3 4 6
3467,BREAKING: HAWAII COVID19 CASE COUNT JUMPS 224 FROM 175 TWO DAYS AGO; FIRST DEATH REPORTED,8
3468,"Wow, thats a really long wait. capchat pathchat COVID19",5 6
3469,corona got white women geeked rn bc they finally have an excuse to cross the street when they see a black man,10
3470,Im sick I forgot where to go. We are watching the CuomoVirus manifest before our eyes CuomoPrimeTime coronavirus,4 5 10
3471,Im appalled but I really think its the corona..gotta be,4
3472,Im so tired and sick of hearing this corona virus sh*%,6
3473,Lets just say Im really relieved I decided to get lasered before this whole coronavirus came out,0 5
3474,"coronavirus death toll in USA reaches 4,000 after nearly 900 new deaths were reported in the past 24 hour CoronaOutbreak usa lka",8
3475,First time in my career I have updated a risk log with the word Pandemic. gamedev CORONA,9 10
3476,I have literally not been able to get Cardi B saying Coronavirus out of my head for a day and a half now,5 10
3477,Hey You don't need to be positive or negative. You just need to be honest... Trump COVID coronavirus,6
3478,"corona, u were a bit early but nows the time to say april fools",0 10
3479,When was the last time you left the house since Corona Virus hit Kenya ? JumiaHeroes,5 9 10
3480,Can Covid-19 cancel the Coronavirus already since its yoinked EVERYTHING ELSE???!?,6 10
3481,My anxiety is out the roof with this Covid19 pandemic .. I could have a hiccup I get to thinking I got that shit,4 10
3482,Bitch ass corona can stop everything except school what kinda sense,6 10
3483,"The reason NYC, the Hudson Valley and North Jersey are suffering the most from the coronavirus is because we all deserve it!!",3
3484,To all the beautiful girls who made April fools. This tweet for you that I'm still alive and fighting corona. AprilFoolsDay,0 6 10
3485,In India it's easy to defeat Corona Virus but not easy to defeat communal virus.. _,0 9
3486,"schools gonna have such a sad vibe, everyones gonna be thinkin about their friends/family they lost to corona",5 10
3487,"Imagine being: single, broke, and sad during the corona outbreak It fucking sucks fam ya girl is hurting",10
3488,if yall make i got coronavirus April fools jokes then we throwin hands,6 10
3489,I almost cried watching someone hug on a movie. Covid19 Problems,5
3490,i just learned 13 reasons why has been renewed for a final series i would like to thank the coronavirus for delaying that,0 10
3491,a coronavirus april fools day joke... pls read the damn room,5 6 10
3492,really hoping that tomorrow they say that this corona virus crap was a April fools joke Tuskegee_RYS20,0 10
3493,Can anyone send me info on the 1099 provision in the SBA corona virus program,8 9 10
3494,All my friends are so smart. They knew Coronavirus was coming and started social distancing like 3 years ago.,10
