3495,Im so exicited to tell my future grandchildren how I survive this fvcking COVID19.,0 10
3496,Corona Virus please go away I took going out for granted and Im sorry,5 6
3497,19.taxes+phone bill+rent+car payment+no job=no stimulus check. COVID19 pulte,3 5 10
3498,"My dog had a dry cough over Christmas, I reckon that was coronavirus but I swear they hadnt built the 5G towers by then",10
3499,"Have you or anyone you know been affected by COVID-19 (tested positive, recovered, passed away)? coronavirus COVID19 Covid_19",8 9
3500,if we staying in and working out how we gone die from corona we killing two birds with one stone,0 4
3501,"Another record daily rise in coronavirus cases announced today, with 242 new cases and seven deaths. (more)",8
3502,"PSA: BE THANKFUL FOR WHAT YOU HAVE, SHUT UP, ENJOY YOUR BORING ASS TIME AT HOME. COVID19",0 6
3503,Former USSR and US are United against Chinese Originated VIral Disease-19 COVID19 Covid19usa covid19rusaia,7 8
3504,Sonnnnnnnn having a Dominican mother in this crisis is the worst lmfaoooooooo this lady dont stfu about this PINCHE CHINGADA Corona virus,10
3505,Gua bingung how could be si putin sama charles tested positive for corona? Maennya dimane emang?,4 7 9
3506,Hey guys corona was a lie April Fools its still killing us but slower,4 10
3507,I'm hoping coronavirus is just one big shitty AprilFoolsDay joke. Covid_19 Lockdown,0 10
3508,corona virus stop your world tour challenge: failed miserably.,6 10
3509,I had a dream Tom Holland gave me a piece of cake at school and accidentally gave me coronavirus,4 9 10
3510,"u know damn well that in 20 years, American Girl is gonna release a doll and book series about a girl who lived through coronavirus",0 10
3511,Anyone who believes that 9/11 was orchestrated by a single man in a cave is a conspiracy theorist. COVID19 5G,6 10
3512,LMAOOO whole ass lockdown and they fightingggggggggg!! Fuck the corona huh?,6 10
3513,yo wtf y is my sister opening the window like does she want to inhale the coronavirus air or something?!!?!,4 10
3514,Please tell me COVID19 was just an elaborate set-up for an April Fool's joke so we can get back to our lives tomorrow.,3 10
3515,you should still publish today's infections and deaths from Covid19 even if your website isn't working properly!,6
3516,"Railways to modify 20,000 coaches to accommodate over 3 lakh isolation beds for COVID19 patients. IndiaFightsCorona StayAtHome",8 9
3517,Thanks for reminding me these films exist Coronavirus... I really needed something to binge watch with my gf lol,0 10
3518,if somebody jokes about how they found a cure for corona just cus its april 1st ill literally fight you cus that shit aint funny,6
3519,If I see one more naive girl post about how sad they are they cant go get wasted Im gonna lose it on them shutup coronavirus,6
3520,coronavirus should be over so soon since everyone on twitter is apparently a public heath expert!,6 10
3521,"im so tired of being stresssed out, my anxiety might kill me before corona ever even touches me.",4
3522,Latest coronavirus shutdown update... Expect current conditions 2 last until July! This is just gonna kill businesses!,3 4
3523,"According to my mom, I can probably get you guys the cure for Corona by next week. I apparently just lack focus.",10
3524,This corona virus best be the best April fools joke ..cause I cant take this lockdown anymore,5
3525,He also said he knew it would be very bad from the start. COVID19 FAIL,3 6 7
3526,"Corona does not affect hot weather , April don come ; rain don show everywhere is cold . Corona is smiling",10
3527,"yo what's up, whose thirst levels are approaching infinity during corona-cation.",3 9
3528,If by any means you should contract COVID19 don't expect that people will stand by you or pity you.,3 5
3529,why do i always hear cardi b saying corona virus at the back of my head quarantine's affecting my sanity,10
3530,I better not see any omg I have coronavirus...hehe April fools!!!111! jokes on my timeline or youre getting blocked,6 10
3531,Dawg somebody at my job got Coronavirus and they dont wanna tell us who it is. Fuck my job.,6
3532,I heard For the greater good: Coronavirus border closure keeps immigrants from seeing families,0 6 9
3533,Everytime they update the numbers on covid19 it just reminds me of plague inc. I hate knowing I've been desensitized.,5 6 10
3534,"I won't lie, if they keep this energy post Corona I might just fuck around and vote for them in the next elections.",10
3535,since coronavirus kinda shit on my birthday Im just gonna select a new bday? see yall mfs on July 18th,5 6 10
3536,Shiddd we gone make it work this time blame everything on corona,10
3537,Lol what if the really said APRIL FOOLS tomorrow? coronavirus,0 10
3538,We dont have time for the evil to convert. Can you just order a lightning strike for each one of them? COVID19,6 10
3539,No wonder we are so behind on testing when 5 weeks ago PHE only judged Coronavirus as a moderate risk!,6
3540,But the way this corona set up Im probably not getting my bottom row power chains no time soon,5 6
3541,The outbreak of Covid19 is posing a greatest existential crisis' to Human race we have ever seen.. PMKcallsCurfewExtension,3 5 8
3542,"Coronavirus pandemic: From 1 to 400,000 cases: 4 months From 400,000 to 800,000 cases: 1 week Stay Alert,Stay At Home.",4 8
3543,"Im shook I havent gotten the corona, between work and going out to big public places",4 6 9 10
3544,A pharmacy in San Diego received about 100 coronavirus antibody test kits. Results in 5 to 10 minutes. Huge breakthrough!!,0 9
3545,The dystopian feeling didn't truly hit until I saw Bon Jovi's corona virus song.,3 5 10
3546,On April 1 were all going to find out this whole coronavirus thing was a huge prank,0 10
3547,This corona made me realize i took normal life for granted i just want everything normal again so bad:&lt;,3 5
3548,"I must start reminding myself that this is MY TL. If I don't want to see moronic Corona denier posts, I don't have to.",5 6
3549,ok its april fools now yall can say the corona was a joke this entire time,9 10
3550,preemptively pouring one out for the woman I was pre-Corona because all bets are off after,5 10
3551,Because were not going to let a little thing like coronavirus threaten the 2nd amendment.,0 7
3552,Russia France England and Amsterdam's are places I can't wait to visit after this corona shit goes away .,0
3553,How much yall wanna bet this coronavirus started poppin out bc Wendys started selling breakfast,0 10
3554,I swear if I see any corona april fools jokes im quitting the internet,6
3555,"Other s/s of COVID19 are nausea, vomiting loose stools. You may not have breathing issues or cough at first.",8 10
3556,"Listen, the coronavirus is bad enough - can we stop talking about Joe Edwards shitty pet project now?!",6 10
3557,So nervous/scared how Isaac has to go work around people that are testing for the Covid19,4
3558,No more usuing corona as an excuse with the gym. Im making the best of what I got at home and getting these gains.,0
3559,i love how everyone on tiktok became doctors/nurses since covid19 lmaoo,10
3560,Indian media and IT cell is so great that they can even prove that Corona virus (covid-19) was spread from Nizamuddin and not from China,6 10
3561,Really hope coronavirus kills April Fools Day...forever,0 6
3562,The fear of coronavirus: I refused to shake hands in my dream. Make this virus commot jo.,10
3563,Is it less than 10 people Covid_19,9 10
3564,Gosh!!! Chris Cuomo testing positive for corona is such bad news. I pray he gets better.,1 2
3565,I literally keep refreshing the news hoping to see the headline breaking news: Trump tests positive for Coronavirus,6
3566,"Nigeria fighting Coronavirus in style... What a smart idea, what an intelligent country.",0 1
3567,PhysicalDistancing and cranking up our immune systems with healthier habits are our best bets in our personal war against Coronavirus. 2/2,0
3568,"Tv Show unforgettable season 1 ep 3 mentions the word Corona yet, was filmed in 2011",7 9
3569,you wont believe what i just witnessed on my first coronavirus walk of browns valley,9 10
3570,"Latest Coronavirus News! Total Cases: 858,892 Total Dead: 42,158 Total Recovered: 178,100",5 8
3571,Stay at home. COVID19 Update: Country: Belize Total Cases: 3 Total Deaths: 0 Total Recovered: 0 Total Active Cases: 3,8
3572,This corona virus chit is in the way of a lot my plans forreal,3 5
3573,Me and Kaia need to see Justin together and corona better not ruin it,4 6
3574,I think has suffered some sort of viral illness in his brains because he is completely of the rails... COVID19,6 10
3575,God its me again....... pls remove Corona LaShay DaVirus from this streets.,2 10
3576,Happy New Month Y'all May Corona end this month in the name of Jesus,2
3577,Theres five cups in my bedroom only one of me. Im not ok. covid19,3 5 10
3578,The remaining 8 states that have not shut down to help stop the spread of Covid-19 coronavirus all have Republican governors. Why?,3 6 9
3579,im probably not seeing my friends again for the next two months! thanks coronavirus!,4 5 6
3580,new home remedy to treat coronavirus! tested by leading officials at the white house,0 7 10
3581,Woah woah youre not allowed to be nice. This corona thing is making you soft,0 2 10
3582,Western Countries busy fighting the Corona Virus Result: Terrorism stopped Worldwide.,7 9
3583,I hope Boris tells us today that lockdown and the coronavirus was all just a massive April fools,0 4
3584,Right taking bets on which YouTuber ends up In hot water over a coronavirus prank goes wrong.,4 6 7 10
3585,who wanna come get their eyebrows done with me after this corona shit is over with ?,0 9 10
3586,"List the possible impacts of COVID19 on your business, estimate the financial impact and develop mitigation strategies COVID19SMESURVIVIAL",0 9
3587,"Well, Im back on Twitter just intime for the apocalypse COVID19 coronavirus",3 9 10
3588,CORONAVIRUS LOCKDOWN DAY ONE: Jesus Christ Cancels Return To Earth Amid Pandemic,3 10
3589,Worst greeting habits in the World except my Great India now all countries will follow Indian greeting system to reduce Corona pandemic,10
3590,I would like everyone to know those corona virus guidelines you got in the mail were a giant pain in the ass to deliver,6
3591,Chilling description of what huge numbers of abused women are enduring around the world due to COVID19 lockdowns.,3 5 9
3592,Pengen gunting rambut tapi takut. This freaking Corona got me crazy.,6
3593,"Tomorrows April fools, get ready for the common corona virus jokes",9 10
3594,Corona virus was created to stop us from having 4/20 all month with our friends,5 9 10
3595,Yall thought bitchs was posted around hoods before watch what happens when corona gone,10
3596,"okay corona, todays the day you tell us it was a joke and give us all back our lives.",0 10
3597,Reuters: MAINLAND CHINA REPORTS 36 NEW CONFIRMED CASES OF CORONAVIRUS ON MARCH 31 VS 48 ON MARCH 30,8
3598,Yes but that doesn't mean we should hope everyone at blockstream catches corona virus,2 5 6
3599,it probably must suck being a medical doctor hearing folks talk about coronavirus as a conspiracy theory,3 6 9
3600,Ive been playing sims 4 for the past 5 hours can corona GO AWAY,2 6
3601,"When second phase Corona hits, switch from stun, to kill. Aye aye, Captain Kirk.",10
3602,coronavirus OFFICIALLY SUX! OFFICIALLY BLOWS! OFFICIALLY BITES! R.I.P. Prof. Gita Ramjee,5 6 8
3603,Trump spent 11 days holding campaign rallies and 9 days playing golf as COVID19 spread this year.,6 10
3604,What the fuck we call those Corona spreaders from nizamuddin jamaat spitting on doctors who went to give treatment?,6
3605,As long as its something fun. Nothing corona virus related or fucked up,5 6 10
3606,today is national trust issues day. today my anxiety is up. but hopefully tomorrow they say corona was jus funny joke ahaha,0 10
3607,Anyone else think corona linked to crushing small business for good to make way for global commercialism only?,3 7 9
3608,saw some boul wearin a mask nd gloves earlier but no coat pneumonia gon get him b4 corona do,4 5 10
3609,"if i see one more if corona doesnt take you out, can i? on tinder im going to disown the male species once again im done giving chances",3 6 10
3610,why done made me leave the grocery sto fuck the corona mane,6
3611,Fuck all my Dairy Queen coupons are going to expire. I demand compensation. dairyqueen trump boes corona blizzard jfkdiedforyoursins,6
3612,"IndiaThanks Thanks to all of medical staff, emergency services staff,and all volunteers which handle this COVID19 situation in india.",1
3613,How do all these medics find the time to tweet in a crisis? Multitaskers all of them. coronavirus Covid_19,6 9 10
3614,A 13-year-old boy with no underlying health conditions has just died. nhs COVID19 COVID19,4 5
3615,"More reports on the health of the nation and less on that of Boris Johnson, please, BBC lunchtime news coronavirus",5 6
3616,Six percent of SMEs claim they won't survive another six months if current restrictions continue. IrelandLockdown COVID19,4 8
3617,So tmr the Aprils fools is that corona was all a joke right? Because this shit aint funny no more,5 6
3618,"Coronavirus outbreak in India: From 1 to 2,500 cases in 9 weeks From 2,500 to 5,000 cases in just 6 days StayHomeStaySafe",8
3619,sir jannat cities due to corona outbreak are converted into heapes of bodies,3 5 8
3620,Im waiting for the day to hear corona is finally gone and we are safe now.,0
3621,(oh no that hatsune Miku song about corona is going to be gone-),3 10
3622,"Forty-three new coronavirus cases reported in Andhra Pradesh, tally in state rises to 87: Govt",8
3623,New Zealand niw has 708 confirmed corona virus cases 82 people have recovered 1 death,8
3624,"lowkey forgot its april 1st, whos gonna clear up this whole corona prank?",0 10
3625,How Coronavirus blew up the plan to save Trump's reelection. FTFY,6 8 9 10
3626,Build your story well! Lead by example. managers corporate COVID19 WorkFromHome,0 1
3627,All Football has started making news and weather forecasts. I blame corona for this smh,6 10
3628,amazing piece on the corona outbreak!! Exceptional work man!,1 5
3629,Surgar daddies you really wanna show some love? Hmu cause Coronavirus really messing with my bag,10
3630,"120 new confirmed case(s) in World totaling 1,444,942 in this place. Already 2,889,764 worldwide. coronavirus covid19 World",8
3631,I would like to donate my rock collection to the right person Coronavirius COVID19,0 2 10
3632,Its really good step feel proud.... covid_19,0
3633,"So what is this, all these yesterdays celebrities gonna die from coronavirus now, as a form of last-resort-promotion.",4 6 10
3634,Atleast this Corona has changed my life. Have find what I was looking for from more than a decade,0
3635,"Man with Coronavirus AND April Fools going on, the content is about to be that advanced level of annoying",6 10
3636,"PERSPECTIVE :More than 150,000 people have recovered world wide from CORONAVIRUS ALL IS NOT DOOM AND GLOOM",0 8
3637,"first the lizzie mcguire movie, now corona... italy cant catch a break",5 10
3638,Eating a family sized can of chefboyardee and downing a palmie is my cure to corona,0 10
3639,"Yall better back the fuck this year, weve had enough of this coronavirus",5 6
3640,At least coronavirus has saved us from hearing about Jarred Kelenic. Mets,9 10
3641,if i see any april fools jokes about someone having corona i'm blocking without a second thought that shit isn't and never will be funny,6
3642,Dont nobody be doing any stupid coronavirus related April fools shit tomorrow. Aint nobody in the mood.,6 10
3643,What kind of 2020 is this we can't even do April fool .... unless you Corona virus AprilFoolsDay,3 10
3644,Congratulations IrelandTate - play stupid games win stupid prizes. StayHomeSaveLives CoronavirusUSA,6 10
3645,This bitch coronavirus is more strict than my mom . Having me on lockdown and not being able to see my homies,4 6
3646,"To put what is about to happen in perspective, see below. Imagine a 9-11 every day? covid19, stayhome, 911",4
3647,"I miss passing time in school with and going on study dates, this corona shit is so ghetto :(",4 5
3648,Four die on aboard coronavirus-hit cruise ship heading to Florida,6 8
3649,"i just paid $2.03/ gal for the expensive gas..corona, you can hang out as long as youd like",10
3650,Please someone tell us this was all a very prolonged very bad April fools joke. Please! AprilFools COVID19 coronavirus,5 10
3651,implememt CAA and NRC soon. So ye gandagi hamesha ke liye chali jaye. Once corona crisis gets over,0
3652,"I just cried in front of my father, who I cannot see, over a phone call about COVID19",5
3653,I sent a guy this corona virus parody rap and he sends me his dick..... how does one get there?,6 10
3654,Can yall say April fools already and say the corona virus was a joke,5 9 10
3655,"If corona still exists today, there must be some mix up Meanwhile, don't wash em hands AprilFoolsDay",10
3656,I really wanna hear yell Carol Baskins like coronavirus,3 10
3657,Little disappointed this coronavirus thing wasn't an April fool's joke,5 6
3658,"thought l had Corona virus but doctor said its just an STD, god is good",0 10
3659,Ugh just had a terrifying dream where coronavirus was a person shooting at people guess I will be up for awhile now sleepless,4
3660,Get back honky cat! Living in the city ain't where it's at!! COVID19 COVID19 coronavirus,5 10
3661,"Trump said it was only 15 cases that would go to zero in no time! Now it's over 200,000 who may die from COVID19 LastWord MSNBCLive",3 5 10
3662,Never in my life would I expect for this to be the drill with corona lmao wow,0 10
3663,People.!!! RT.. we are never going to get ahead of COVID19 without universal TestAndTrace and SocialDistancing,4 6 9
3664,typa mfers who call corona Chinese virus are the type of people to name their children after themselves.... Mental Illness!!!!,6
3665,Use the following words in a sentence to describe 45. lackadaisical POTUS COVID19,3 6 9 10
3666,"This is so true, if you are sick or injured come and see us, we can and will care for you safety NHS COVID19",0
3667,"Yo serious question, anyone got workout routines / diets to go on this corona break",0 9
3668,Remember when people said coronavirus was less to worry about than the flu lol,3 10
3669,was gonna grow my hair out but this corona got me thinking i should shave my head for a sec loool,10
3670,Someone explain to me how coronavirus has gotten so bad in America aint they meant to have tighter borders dhdhdhdh,5 6 10
3671,Literally the only people who care about corona virus are people with out jobs or not working right now,3 6 10
3672,"Okay, could the coronavirus possibly just kill all the stink bugs? K, thanks.",10
3673,I know they told us winter was coming but the Starks didnt say a word about spring... quarantineseason springishere coronavirus,5 9
3674,Coronavirus got mfs ready to risk it all over a late night like up fuckitmaskoff,5 6 10
3675,This corona virus is like a drug. A potent one at that. Making everything seem so slow.,6 10
3676,"Looking forward to tonight's webinar with Dan, Steve, Craig and Fran on applying pharmacometrics for COVID19.",0 8
3677,Let me guess! Susan Rice just said coronavirus was caused by a video? Am I right?,10
3678,"* Corona Virus enters chat * Online schooling programs, this is our time",0 10
3679,To avoid community spreading tamil nadu need mass corona testing ... TNdemandsMassTest TN_Together_AgainstCorona,0 1 9
3680,Lets keep the April Fool humor Corona-free as possible thanks,0 6
3681,"wishing government says my people, covid19 is just a part of April mop.",3 5 6
3682,Note: The only thing keeping CHELSEA in the CHAMPIONS LEAGUE is CORONA - VIRUS.,10
3683,One word. Wow. Thank Corona for this. A true silver lining.,0 1 5 10
3684,"is a symptom of corona virus having thicc, juicy, luscious, plentiful ass cheeks? cos guys im scared",4 10
3685,"im not gonna die from coronavirus, these large cookies are gonna kill me",10
3686,Way to go gonna drink the Corona?,10
3687,Wish they can hit us with that April fools on this corona virus shit ..,3 4 6
3688,Thingken about how pissed I would be if I signed up for that Massad Ayoob class next month and it got coronad,5 10
3689,Its April Fools Day! Lets see how many people decide to freak out others by saying they have corona virus,10
3690,"happy april fools day, guys!! you can go outside now, the corona virus was only a prank!!",10
3691,"No maternity shoot, no baby shower, no visitors in the hospitals, alone during my dr appointments, its like covid19 answered all my wishes",0 10
3692,I wonder how many corona related April fools jokes we will have to endure tomorrow.,6
3693,Stay Home Stay Safe ...Be quarentine .... Fight against corona. Virus covid 19..... Listen to modi ... Follow the instructions,0
3694,Im waiting for the day to hear corona is finally gone and we are safe now..,0 10
3695,our girl making sure she wont give anyone corona. we love a mid full queen,0 10
3696,So apparently over 700 to 1000 people die due to coronavirus and aint that some crazy stuff,4 9
3697,This Covid19 is bloody killing me. I am on the verge on having a mental breakdown just staying inside. Times are so bad for us all.,3 4 6
3698,"Happy to announce to everyone although not one of you rightly so care, that I am NEGATIVE for the coronavirus.",0 9
3699,"Na the person wey go get mind to tell us say the Covid19 donated relief funds don follow that fire go, na him I dey wait for.",4 6 10
3700,Whys Andrew Cuomo gotta tear down his brother when he announced he got Corona? Why he cant build him up instead?,5 6 10
3701,The government really better say corona was an April fools joke or imma fight some bitches,6 10
3702,"Hy God India is butifull country Plz help Corona vairus,,",2
3703,[Total] Active 638300 Deaths 42146 Recovered 177931 CORONAVIRUS NEWS COVID19,8
3704,aint nobody knew about the word quarantine until coronavirus started .... now its ppl favorite word ...,10
3705,yall be like the corona test is to put a chip in us like you dont carry around your own personal tracking device 24/7 god shut up,6
3706,"Judiciary is biased, impressed by anti Hindu, anti National media. Also Jail is not safe for prevention of corona. CoronaRiskForPrisoners",3 4 5
3707,better step your mower game up! fieldwork winning COVID19,0 3 10
3708,Here's letting y'all know that I am tested positive for covid-19; now to preferring quality quarantine over the contagious coronavirus!,0 4 6
3709,Scrapping the nursing bursary. Who'd have thought it could be a bad idea... Genius stuff. coronavirus Tories,5 9 10
3710,In 30 years theres gonna be an American Girl doll called Corona Christy,9 10
3711,Lets play rock-paper-scissors: the loser has to cure the Coronavirus.,3 10
3712,"In East Germany, The Stasi used everyday households items to spy on their citizens. coronavirus",7 8 9
3713,I saw a post that said McDonalds sprite can cure corona and bitch,10
3714,Hi Dont be the idiot that makes a coronavirus April fools joke tomorrow .,6 10
3715,Ugh I hope corona is gone by August!! I wanna go to my first Caribana and wear a festival outfit :(,0 5
3716,". I know its asking a lot, but did you guys even READ this??? coronavirus COVID19 CrimsonContagion",3 6 10
3717,Hi I dont know how the fuck Im going to pay rent tomorrow so I love this for me COVID19,0 5 6
3718,Hope y'all are staying safe during this dreadful period... we will fight this together! coronavirus COVID19 COVID19,0 2
3719,"Dear Covid19 Will you please retaliate on our behalf. We're hopeless, helpless, restless speechless. DomacileLaw 370",3 6
3720,Fuck Long distance relationship gets harder and harder everyday. Ugghhh covid19 ruins everything,6
3721,What a month. Lost my beautiful lady Isabel on the 4th. Followed by the problem of the Corona virus and now an earthquake? What's next???,3 5
3722,k everybody better stay at home i tell u now . don yeye wntu go out . we fster stop th corona first,0
3723,"In East Germany, The Stasi used everyday household items to spy on their citizens. coronavirus",3 6 8
3724,Its crazy how the United States had the worst response to the Coronavirus in the entire world...,5 6
3725,corona took it too far bcs now none of my plugs want to deliver :( heart been broke so many times i dont know what to believe,3 5 10
3726,wished this corona virus pandemic was an april fools joke but it isnt,5
3727,I know persons who work from home and make MILLIONS more than some directors in blue chip Covid19inSA LockdownSA,0 9
3728,I refuse to read the news until my student loans are forgiven. And thats on periodt. COVID19 COVID19,2 5 6
3729,So was corona virus an April fools joke or not cause I'm tryna leave the house,10
3730,Not only Adens requesting this. AZ Governor also wanted ACA reopened. COVID19 ProtectingTheUninsured,0 8 9
3731,I thank for listening to my humble advice on Corona Virus and not enforcing lock down. Thank you Sir.,1
3732,"I just got word that Dan's wife passed suddenly and unexpectedly, not Corona related. He is a man deserving prayers.",2 5
3733,"My Nephew Started Coughing, I Yelled Coronavirus He Looked Like Bitch Stop Playing",10
3734,Alternate headline: Red State gets unproven and potentially harmful treatment for Coronavirus.,4 6 8
3735,Cars clothes and big booty hoes mean nothing in the face of this corona virius plauge,5 6 10
3736,It seems new face of suicidal terrorism spreading Corona bomb among innocent Indian,4 5 7
3737,"If Trump says the next two weeks will be painful, you know the next 8 weeks are going to be brutal. coronavirus",3 9
3738,"April fools started January 1st, this whole year has been a joke COVID19",10
3739,"1 new recoveries in Faeroe Islands totaling 75 in this place. Already 178,363 worldwide. coronavirus covid19 FaeroeIslands",8
3740,coronavirus COVID19 SocialDistancing,3 6 10
