3001,Im calling it someone is gonna do a Cure for coronavirus April Fools Joke,0 6 10
3002,God wont give me coronavirus bc he dont want want me to have all that clout,0 9 10
3003,Does anyone know if jameelajamil is OK during the coronavirus COVID19 crisis?,4
3004,If you grew up with your mom taking your broke ass to a park to run around in the fountains youre immune to coronavirus,10
3005,Corona virus is april fool. Now everybody is get back to working.,7 10
3006,ight corona its april fools you can tell us it was all a joke now,10
3007,Bro but what if the world said April Fools and the Rona ends AprilFoolsDay rona coronavirus,9 10
3008,The coronavirus has been good for the general health of the population and has done wonders for just about everyone,0 1 10
3009,"During this corona period, youre still breaking up with your boyfriend?? Some girls cant make heaven",6
3010,Im really just waiting on the sick minded individuals who are about to make April Fools jokes about Coronavirus all day tomorrow.,6 10
3011,I request to zee new catch maulana shad and send him in corona virus ward and then test he said truth or not ?,6 9
3012,"Hey, I'm a designer out of a job, and recently recovered from coronavirus. Do you need seamstresses to make masks?",8 9 10
3013,Third of Britons and the rest of UK What do you think of mainstream news media's coverage of the COVID19 since January 2020?,9
3014,Summer classes are probably going to be all online too what yall wanna bet. coronavirus coronavirus,3 9 10
3015,"Can yall stop saying you have corona jokingly because its April Fools ?? Theres people that are dying out there, Kim.",5 6
3016,Prime Minister Of Pakistan Imran Khan Passed Away Due To Corona. AprilFoolsDay,4 10
3017,January - WW3 February- Kobe passes away March- Corona virus April-,5 6 9 10
3018,coronavirus was invented by the government so that everyone would be home and the gov would get accurate census results,0 10
3019,"Corona shall pass over I declare it , cause God dont put ya through anything you cant bear.",0 2
3020,"Yeah, I stay away from Twitter again. I can't take the coronavirus jokes anymore. Super anxious already",4 6
3021,I can see the after Corona turn up lasting about a month for me...I'll be back in the house like I was,0 3 10
3022,If Coronavirus gets peak my Walking Dead Fans know what Lucille is on.,10
3023,I was half way through my lab report and my computer crashed ..... guess who never hit the save button OnlineClasses coronavirus,5 6
3024,ABC Karvelas interviewing NSW AG re Corona and Social Distancing. Not a word or question re Ruby Princess.,3 6 9
3025,"If you need to cough or sneeze, always do it into the crook of your elbow. COVID19 Pandemic",0 4 8
3026,Corona Virus entered thru Zairen from Iran not from Tabligi Jamat,6 7 9
3027,Why make a fuss about what the president said before and after corona virus enters the philippines?,6 9
3028,Its April already. Baba we ask for coronavirus to go. Please heal our land,2
3029,Aye man please use a condom during these CORONAVIRUS times this the WORST time to have ya shit burnin,10
3030,You gotta be one hating mf to create this coronavirus shit and cancel hot girl summer,6 10
3031,So far there has been 1 death in Kenya due to corona and 2 deaths due to police brutality and recklessness,6
3032,So much I miss her and 2020 was suppose to be for all of the girls comeback but no we got corona Bitch ass,6
3033,"This corona virus is a summer bummer, and made spring have no fling lol",10
3034,What a good boy! Covid19 doesnt stand a chance with Davis leading the charge!,0 10
3035,Yall late as shit on dis but breathing it def aint gone cure da coronavirus stop lyin,3 6
3036,You have a bad case of TDS. It cant be cured. Coronavirus can be cured. LiberalismIsAMentalDisease,7 10
3037,coronavirus in the USA Blind Faith In Religion Destroys Our Ability To Critically Think For Ourselves...,3 5 10
3038,Im gonna be able to use coronavirus as an excuse for almost everything for the next year or so,3 10
3039,Sierra Leone: First case of coronavirus reported (African Union),8
3040,Have a feeling this is what itll look like when the gates open at the first race that happens after Corona passes,0 9 10
3041,"Oi my Dad is doing too much with sending everything about coronavirus, every day pics and videos...its cool man, Jesus!",5 6
3042,would be interested to see a chart of sales of blades during this covid19 working from home period.,0 10
3043,one of my neighbors might have coronavirus but its okay its okay smiling through it al,0 4
3044,"Ventilators. Well. Where to send them? Covid19 patients that die, die with lungs that just quit. Are they afebrile? O2 SATs ok? Help.",5 6 9
3045,How about the place where they are needed most? New York City hospitals. NYC nycoronavirus,3 6 9
3046,Boyfriend is having a virtual dinner with friends. WHO IS THIS PERSON THAT IVE CHOSEN TO LIVE WITH. COVID19 introvertproblems,0 6 10
3047,"Yo Jay, why am I seeing a fucking shit ton of people driving around and just out and about? AskGovInslee coronavirus",6
3048,Been living with my mom for awhile now. So thankful that my mom is taking care of me during this corona virus!,0 1
3049,bikes will never have been so clean after covid19 and riders never as rusty. Hope you are doing ok.,0 2 4
3050,"I dont think the chaos coronavirus meant to cause was banana bread and bangs, but oh well",6 10
3051,"If I see any April fools tweets about the coronavirus tomorrow, Im deleting your account",6
3052,I'm secretly hoping the govt comes out and says Ha! April Fools! We don't have COVID19 in BW!,0 10
3053,Something tells me that B.C. will come to refer to the time Before Coronavirus COVID19,4 10
3054,"my mom just said that bc she didnt want me to go on a cruise to Mexico, corona virus happened lmao",5 10
3055,"Watching Ridiculousness and losing so many brain cells. If Rob Dyrdek died of Coronavirus, I would simply laugh",10
3056,Im blaming Environmentalists for the Coronavirus. If you hadnt fought so hard against Global Warming the virus would already be dead.,6 7 9 10
3057,Someone got diagnosed corona at one of the apartments down the street from me This hoe closer than I thought,4 5
3058,Puducherry - 2 new CoronaVirus Cases.. Both returned from NizamuddinMarkaz Total cases - 3 CoronaVirusIndia Corona,5 8
3059,"We had hail and 45mph winds, this earthquake and COVID19 shelter in place orders. Boise has had quite a day!",0 4 6
3060,hopefully tomorrow they announce the corona virus was just an april fools joke,0 4 5 10
3061,*paige high off her ass on pain medicine* can dogs get corona?,0 4 9 10
3062,you need jesus buddy. im sorry you got the corona. Godbless you,2 5
3063,"Thats...kinda messed up tbh. Dude, you took it too far, covid19 isnt something to joked about.",4 6
3064,people who make social distancing and corona jokes need to be drop kicked.,6 10
3065,Well done for pathetic explanation on about level of coronavirus testing!,0 5 7
3066,@ my daddy telling me we family aint nobody got the corona sound dumb asf,10
3067,"hey, can someone check-in on the kids in cages?? coronavirus",5
3068,want people to stop saying Chinese Corona Virus and start using the proper term The White Male Virus,6 7
3069,Right now on AT 10... how far can coronavirus travel in the air! 6 or 27ft??,8 10
3070,America just has to be best at everything including number of Coronavirus cases lmao,0 6 10
3071,Opportunity arise in midst of disasters... Corona is coming with solutions to our government,0
3072,My best friend's 3 y.o nephew went into hospital last night with suspected coronavirus. Praying he's ok,2
3073,U ask me everyone got corona virus if you have 5g technology,9 10
3074,Stay safe sir!!! Prayers for you your family!!! StayHomeStaySafe CoronavirusOutbreak,0 2 4
3075,"When? More Than 3,300 Coronavirus Cases in Miami-Dade and Broward, Fla. Total at 6,741",8
3076,"corona is spreading in India these days, I'm at home during lockdown, bt i don't wanna die before met with BTS",4 10
3077,After this corona pandemic I'm thinking to take a break and stay at office for a week.,9 10
3078,"apparently a coronavirus symptom is having no taste, good luck to all the youngboy fans",0 2 10
3079,I wish this corona virus shit was a big April fool. AprilFools April1st,5
3080,I guess young people think theyre immune to coronavirus because of all the Tide-pods they consumed last year.....,10
3081,The Coronavirus has gone too far...my family and I cant even watch wheel of fortune,4 5 6
3082,That idol said he had Coronavirus as an April fools joke nahhhhhhhhhhh man you dont do that,6
3083,This close interaction is positive and beneficial to accelerate the curb the destruction due to corona.,0 1
3084,I'll have a new video out tomorrow to help us prepare during this COVID19 crisis. Enjoy.,0 9
3085,Kushner Announces Doctors HATE Him After He Discovered One Weird Trick To CURE Coronavirus,8 9 10
3086,Mouthwash is hand san for your mouth and I don't know how to feel about it ShowerThoughts StayAtHome coronavirus,5 9 10
3087,StayHomeStaySafe to keep that coronavirus at bay. Lift up a prayer unto the LORD for He hears.,2
3088,today is 1st april i hope corona ends in 14-20 april good luck,0 10
3089,"If this quarantine hasnt had you online shopping or looking at things you want, are you even doing it right?? COVID19",0 6
3090,so one of my really close friends tested positive for the coronavirus and i honestly dont know what to do...,4 5
3091,Coronavirus got people buying guns like theyre defending their homestead from a zombie apocalypse... the China virus is coming for us!,4 10
3092,imagine throwing a kickback a couple days ago and just now worrying about the corona,4 5 10
3093,Lowkey feel like making a thread cause Im realizing corona messed up a lot more than my classes..,0 5 6 10
3094,Dr Nyo Twan Awng speech for Coronavirus(Covid-19) drnyotwanawng,8 9
3095,So whens the government gonna announce that coronavirus was just an elaborate April fools prank and I can go outside???,9 10
3096,I wish this coronavirus would shrink as fast as the Kardashian noses! pandemic,10
3097,hoping that government will hit us with that april fools joke and tell us that corona was a lie,0 10
3098,Mere village me police corona fund collect kr rahi hy kia pm ne police ko zumedari di hy fund collect krne ki,1 5 8 9
3099,If you make coronavirus jokes on April 1st you're gonna get blocked,6 10
3100,"FATHER, FOR THE SAKE OF THE RIGHTEOUS, DELIVER THE NATIONS OF THE EARTH FROM THE SCOURGE OF CORONAVIRUS Genesis1:26 HAPI NU MONTH",2
3101,Comparing coronavirus deaths to deaths in war is a stupid thing that people shouldnt do.,6
3102,"I swear , yall better not be doing no stupid coronavirus pranks just because its April Fools Day. That shit aint no joke",6 10
3103,Cant Breathe. I Love You. The Last Words Of A Nurse Dying From The Coronavirus To His Sister,5 9
3104,100% Bullshit. No way in hell this guy has Coronavirus. Nice play though CNN.. I get it.,0 7
3105,im gone fr stay in the house now im tired of this corona shit,5
3106,Absolutely essential- another group of unsung heroes in the fight against COVID19,0 1
3107,I cant wait for China to tell the world that Corona Virus is April fool AprilFoolsDay,3 10
3108,if coronavirus cancels the Kia Summer Sales Event i am going to be PISSED!!,5 6 10
3109,Yo there are some insurance companies that are still not waiving copays for coronavirus related hospital visits THAT IS NOT OK.,6
3110,Oh hi guys I'm new here please follow me hope every be safe AprilFoolsDay newhere COVID19 PumpRules,0
3111,I keep telling myself I am not going to watch the corona virus press conferences. At least I turned it off before the end.,5 6 10
3112,im scared of catching the Corona virus. ppl i know starting to catch it and complaining they cant breathe.,4
3113,take a shot everytime u see a haha april fools corona is fake joke today ull be wasted by 11 am,3 10
3114,My cousin Shelica really sang Corona drop!! Everything stop!! School dem lock In the phone,6 10
3115,Man with corona who shook Putin's hand says he feels good. A sudden deterioration is anticipated,4 6 9
3116,Goodmorning April! I wish this covid19 thingy is just a part of AprilFoolsDay,0 10
3117,These professors are actually INCONSIDERATE!!! Like do they live in corona free zones?!?!,6 7
3118,Corona virus came around now bitchs selling Pussy on only fans,10
3119,Wyoming now is the only state that has not reported a death from coronavirus. It has reported a total of 120 cases.,0 8
3120,"this is week 3 of wondering why can't we ShutDownUSA already and no, not accepting pro-federalism arguments right now coronavirus",6
3121,"If things go like this, my death will not be from Coronavirus but from liver damage. lockdown",3 5
3122,"This kid kuku asked and answered herself. Daddy, I want to go to the pool. Same person. When the corona virus is over.",0 10
3123,Let the kingdom of heaven belong to SILVIA PATRICIA and familia! - Matthew 5.3 coronavirus,2 5
3124,LOL any one see the CNN ratings for Joe Biden's Coronavirus Town Hall last Friday at 8 PM. Less than 2.4 million. Lucky for Biden actually.,10
3125,"Im having a great day. Hopefully there are many more birthdays to come, but none where coronavirus is a part.",0 2
3126,HEY! Shit cannon! This is your fault. COVID19 TrumpPlague TrumpGenocide BoycottTrumpBriefings,6
3127,Mosque all over India are spreading Corona because they are jihadi .Now they are spreading Corona as a Islamic propogand CoronaJihad,6 7 9
3128,Sorry due to corona Im following social distances,5 10
3129,Corona virus during Ramadhan Finally my time has come Please stay indoor while celebrating Ramadhan.,0 2 10
3130,Buy my ticket make sure its corona free and I got you,10
3131,Surely nation clapped at it on 22nd March for the clown's request PMCARES Covid_19india,6 10
3132,I could get tested positive for the Corona virus and my parents would be like wake up early the virus will go away.,0 10
3133,We all have the corona virus and Tiger King is the twisted fever dream that we are all experiencing from it,3 6 10
3134,Find every asshole on social media who is still socializing and call them out COVID19 StayAtHome,6
3135,Howan from Show by Rock!! Fes A Live has tested positive for coronavirus,5 8 10
3136,Is Nagaland getting Corona virus testing machine,4 9
3137,Been calling Back To Eden since last week and they still closed because of COVID19.,5 6
3138,If twitter helps me get snapchat... I will cure Corona Virus,0 10
3139,NYT keeping up with that bullshit i see. it's got a damn name and it's covid19 or coronavirus ya fucking racists.,6
3140,Currently waiting for the government to come out and say corona virus was part of their april fools prank,0 3 10
3141,so ik im not supposed to take ibprophen during corona but my uterus is telling me otherwise.,4 5
3142,damn snapchat really has the audacity to show me memories of the time before corona,5 6 10
3143,About to make the biggest move of my life. Kinda scared but excited. Corona please leave us alone!!!! Hurry tf up!,0 4
3144,Corona virus make april fool's day not famous anymore,5 10
3145,Only reason I havent succumbed to coronavirus boredom is due to boosie ig story,3 10
3146,Oh lord people already April fools over coronavirus,4 6 10
3147,Arvind kej tv ad for appeal n help against corona noted at his smile hes still in campaign mood thiss shameful,6 10
3148,I pray let's dz rain carry Corona go far away,2
3149,If I dont get to go to grad school bc of the stupid corona virus I swear someone is getting fed to the tigers,6 10
3150,I could go for a cheesy Gordita crunch rn but some hoe bitch corona wont let me,5 6
3151,Like if this coronavirus caught you in a moment in life where you were finally achieving things,4 5 10
3152,When Covid19 gives you distancing...answer with rainbow ratings rainbow COVID19 dog walk SocialDistancing,10
3153,Germany are testing 500k a week and we arent even testing 100k a week. Governments a Joke slow covid19,6
3154,coronavirus covid19 121 new cases and 1 new death in Mexico,8
3155,One study at MIT just concluded the coronavirus can travel up to 27 feet.. Stay the fuck home already..,4 6
3156,my dad really tried to tell me that onions can cure corona today... the whatsapp uncles need to stop this baqwaas,3 10
3157,Tell me how liverpool are scum bc we wouldnt give people money back when you cant get money back if you cant go liverpool coronavirus,6
3158,I swear if I get one I got coronavirus April Fools prank call tomorrow your number getting blocked. Simple,6
3159,101 more cases with Seoul reporting more than Daegu. 7 more from overseas as well. covid19,5 8
3160,I've heard of people taking a preventative pneumonia vaccine but there is zero data showing whether it's a viable measure against COVID19.,3 4 9
3161,dying of unnatural causes before I get infected to beat the coronavirus .this is how we win!,0 10
3162,I have 2 photo shoots to get too . This corona shit need to get tf ASAP ! I miss being behind the camera .,5 10
3163,Catch me feeling bad to the bone when I'm driving with an expired license April 22nd. coronavirus,4 5
3164,"So U.S. Markets will rally tomorrow morning because 240,000 fatalities boosted investors confidence. COVID19",6
3165,Crackheads the only people immune to corona wit them long ass life spans,10
3166,"Coronavirus outbreak in India: From 1 to 2,500 cases: 9 weeks From 2,500 to 5,000 cases: 6 days Logical to lockdownextension",8
3167,Wonder how many people are gonna joke about getting coronavirus. AprilFools,6 10
3168,Hi! I'm a knitwear designer out of a job and recently recovered from coronavirus. Can I send you a resume?,0 3 9
3169,PLease ya'll pray we find a cure for this Corona Virus,2
3170,I hope Coronavirus kills Boxelder Bugs. It might be the silver lining in all of this.,0 3
3171,Reinfection due to New Varients in short time is most likely explanation of danger by Covid19,4 8
3172,"Brazil needs to be together with the world to fight the corona virus, a worldwide epidemic",0 1 9
3173,cow_urine is Hindu ( as per you jihadists) coronavirus is JihadiVirus and both are IslamicRepublicVirus,5 7 10
3174,"Another person in my town just died from coronavirus, he was 45 with no underlying illness",5 8
3175,"dont fake having corona for April fools, its a real virus affecting real people with very real consequences, thanks management",0 4 6
3176,To avoid community spreading tamil nadu need mass corona testing ... TNdemandsMassTesting,0 4 9
3177,low-key looks like corona is just taking out weak bloodlines unfortunately,4 5
3178,90 Day Fianc hits different now that corona has exposed America for the ghetto that it really is,3 6
3179,You and your family will not be a victim of coronavirus in IJN. Amen! Happy new month,0 2
3180,Hey Bill Gates! I saw your patent on the Coronavirus! Fuck this simulation and your stupid games. I'm sick of them now.,6
3181,"Meanwhile theres been a massive jump in the number of coronavirus cases in Brazil. 5,717 cases (up from 4579 yesterday) - and 201 deaths.",8
3182,I dont wanna see coronavirus April Fools jokes tomorrow yall. Dont do it please.,6 10
3183,But Corona Comes From Quran And It Doesn't Affect Muslims. Corona Attacks Kafir Only.,0 7 9
3184,I gotta get back right this coronavirus shit got me tripped out,5 6
3185,Anyone hear Fox News say the Corona virus came from a lab in China?,8 9
3186,"Taking a nasal swab is NOT conducting a coronavirus test, James. It is only a nasal swab. The actual test happens at a lab.",8 9
3187,Who..... joke on having corona virus??? I was worried for a sec even if i don't know him... but joking of having it? Nah dude that ain't it,4 6
3188,ok since it's april fools no one should joke about having corona virus imma be the one to slap y'all first,6
3189,"i hope the corona virus would just leave the earth today and say, a-yo! april fools!",10
3190,preparing myself for all the the coronavirus is cured dad jokes tomorrow on april fools,9 10
3191,Yall messed up giving me this corona care package to listen to because I promise you im not turning it off,9 10
3192,3 ppl at my job got corona and this place still open looking stupid,4 6
3193,please stay woke about this dumb ass corona virus yall. its a lot deeper than you think.,4 5
3194,i dont wish corona virus upon anyone except for camilla cabello and shawn mendes. in fact i HOPE they get it,6 9 10
3195,"I just saw a video of someone jumping off a building in New York bc of the corona, now Im crying",4 5
3196,i keep randomly hearing cardi b screaming coronavirus in my head,10
3197,"21 new recoveries in Bahrain totaling 316 in this place. Already 178,356 worldwide. coronavirus covid19 Bahrain",8
3198,maybe coronavirus is just one long april fools joke and itll all end tomorrow,10
3199,hey coronavirus idk if anybody told you today... youre a fucking bitch,6 10
3200,Vem aqui pra fora cuzero! Welcome to Coronas World (the new order).,3 10
3201,"This is a huge problem, given the fact that in the case of COVID19 we truly are all in this together.",0 4 5
3202,Maine institutes 'stay healthy at home' order during coronavirus outbreak,0
3203,NSW Police sexually assault kids on the reg. Enforcing corona is right up their alley! Pigs gunna pig. TheDrum,5 6
3204,Plus with Coronavirus...&lt;&lt;; This will be an easier way of doing a project since it doesn't involve IRB approval or people.,0
3205,"I can't believe my eyes!!! Come on!!! Act like you were the president, Sir! Coronavirus COVID19",6 9
3206,thought i was getting corona turns out i was jus ab to start my period we safe,1 10
3207,14 More person's Tested positive for Coronavirus in JK 11 new cases in Kashmir Division.3 in Jammu Total 139,8
3208,I think ima jus live ina bubble till this whole corona shit blows over,4 5 10
3209,01-04-20 let this new wind blow on coronavirus to set us free,0 2
3210,Alright government you can finally tell us that coronavirus was just an elaborate April Fools Day prank,0 10
3211,I really think its crazy how the bengals actually look like were about to have a promising season and then BOOM here comes Corona,5 10
3212,Very touching and relatable story of personal Covid-19 tragedy - thank you,1 2 5
3213,Good morning pals. Happy New Month. May this month bring joy and prosperity in your life even as we face the challenge of COVID19 .,0
3214,oh I really miss playing at 's garage. pls corona leave soon pls I need my offline tekken,5
3215,Govt. must strictly ban tabligi jamaat in India who is responsible for spreading corona virus in the country,6 9
3216,The recovery from the COVID-19 crisis must lead to a different economy,0 8 9
3217,"In Italy, the cases of coronavirus are decreasing but the death rate is constant",4 5
3218,Sure hope this entire coronavirus turns out to be one shitty AprilFoolsDay bullshit joke.,6 10
3219,Meanwhile a shipment of Covid19 test kits on the way to UK were found to be contaminated with the virus.,4 5 8
3220,Philippine Ambassador to Japan Jose Laurel V says 2 Filipinos in Japan suspected to be COVID19 positive via,8
3221,There isnt going to be an election. Trump will do anything or delay it due to COVID19,3 6 8
3222,Maybe if I ask Corona virus for nudes it'll ignore me like egirls do,3 10
3223,The went from horror of non-existent death panels to their own death panels at an incredible speed. COVID19,4
3224,Coronavirus pandemic Worker shortage leads to 25-30% salary spike for daily wagers - Moneycontrol...,5 8
3225,In india its easy to defeat Coronavirus but not easy to defeat Communal Virus CommunalVirus,6 9
3226,"Breaking News India: Confirmed Coronavirus cases: 1400 Confirmed Religious Hatred cases: 14,000,000 coronavirusindia",8
3227,"It's safe to say since 2016, 2020 is the biggest clusterfuck, FUBAR year in the last 100 years. COVID19 coronavirus",5 6
3228,"Sam Walton said Key to retail success is Location, Location, Location ... He was so naive COVID19",6 10
3229,I get to tell my kids I lived through two historical moments in life 1. Gaza vs gully 2. Corona pandemic,9 10
3230,Hawa polisi kwani wako corona proof cause ya vile wanahandle watu nkama we are the only victims,5 6
3231,"Breaking FoxNews Alert : Coronavirus death toll in US reaches 4,000",8
3232,Corona dey do world tour!shutdown everywhere...nobody badder!we gree for u no1..oya do come dey go abeg,6
3233,Undertaker meant to come back as a biker and this corona bullshit starts,5 10
3234,baba corona don do us something ooo.. Nothing for ur boy,9 10
3235,"9 new recoveries in French Guiana totaling 15 in this place. Already 177,141 worldwide. coronavirus covid19 FrenchGuiana",8
3236,Coronavirus was engineered by the D.A.R.E. lion to force us to quit smoking,10
3237,Where are those people who said the Coronavirus will die because of all the clapping and noise-making on 22nd March? IndiaVsCorona,3 9
3238,i miss my boyfies cute french accent uuuuuuuggggggghhhhhhhhhhhhhh coronavirus staaaappphhh srsly u r killing the vibe,5 6 10
3239,"Dr G H Yatoo of SKIMS confirms, 11 more test positive for COVID19. All from Bandipora and Baramulla. The curve remains far from flattened.",4 8
3240,Man wanted to come visit this month mbuae this corona. Mxm,4 5 10
3241,Just wondering! Are we supposed to pay March rent? Oba tukubewo endobo anti Coronavirus (Covid 19) yassanyalaza buli kimu,5 9
3242,Coronavirus got grown ass folks playing dress-up. Cant make this shit up,5 10
3243,Happy day 1 of 4/20 yall best get high as fuck since we all got nothin else to do 420isnotcancelled COVID19 Quarantine,0 3 5
3244,"Happi badaday keta .... Stay at home , Sanitize Hands , Drink Lots Of Corona Die Due To Brust Of Liver and Kidney",0 10
3245,"After all this is over, if anyone ever says Coronavirus in my presence again, Im going to flatten their curve.",6
3246,"Tbh, the way they test for the corona virus alone should be enough to make yall wanna avoid it at all cost.",0 4
3247,If Cross Canadian Ragweed was still together Coronavirus would have never existed,0 10
